url,contents
dailyslotsrewards.com/double-down-casino-free-spins-30-link8-2,Double Down Casino Free Spins 30 Link8 - Daily Slot Rewards. doubledown Free Chips and Promo Codes
dashfight.com/mk11/rankings,Top Mortal Kombat 11 Players - Ranked by DashFight . DashFight. The list shows the best Mortal Kombat 11 players - Find out whos the best right now.
dosgamesarchive.com/play/crazy-drake,Play Crazy Drake online . DOS Games Archive. Play Crazy Drake in your browser on DOS Games Archive.
eso-skillbook.com/skill/eternal-guardian,ESO - Skillbook . Eternal Guardian. All the information you need to know about the Eternal Guardian skill in The Elder Scrolls Online. Read more about the Eternal Guardian skill.
game8.co/games/kirby-and-the-forgotten-land/archives/372548,"Masked Hammer Treasure Road Guide: How to Beat the Target Time . Kirby and the Forgotten Land.Game8. This guide will show you how to beat Masked Hammer Treasure Road in Kirby and the Forgotten Land. Read on to learn how to clear the challenge within the target time, which ability is in use, useful tips, and rewards!"
gamesgames.com/game/red-ball-forever,Play Red Ball Forever online on GamesGames. Keep on rolling in&nbsp;Red Ball Forever. Can you keep this little guy safe while he explores a kingdom full of danger in this ball game?
gamesnostalgia.com/game/starcraft,"Starcraft (Windows, Mac OSX) Game Download. Starcraft - Get it on GamesNostalgia - StarCraft is one of the most influential real-time-strategy games ever created and one of the most important video games of all time."
gimmemore.com/en/quiz/jv6te/answer/81rbanez6x2l,The Ultimate Harry Potter Quiz. Welcome to Hogwarts School of Witchcraft and Wizardry! How much do you know about the world of Harry Potter?
itstillworks.com/12175519/how-to-fix-a-stuck-pixel-on-nintendo-ds,How to Fix a Stuck Pixel on Nintendo DS . It Still Works. 
lexulous.com/v2/g/32599234,"Game #32599234 - Lexulous Word Game. A word game that is addictive & challenging! Play with friends, people across the world or in solo mode. App is available for all Apple and Android devices."
lexulous.com/v2/g/32799063,"Game #32799063 - Lexulous Word Game. A word game that is addictive & challenging! Play with friends, people across the world or in solo mode. App is available for all Apple and Android devices."
myanimelist.net/anime/32717/aikatsu_stars,"Aikatsu Stars! - MyAnimeList.net. Looking for information on the anime Aikatsu Stars!? Find out more with MyAnimeList, the worlds most active online anime and manga community and database. Yume Nijino has been accepted into Four Stars academy, home of the beautiful and talented S4 idol group. She and the other newcomers are determined to discover their talent, with a choice of specializing in beauty, singing, dancing, or drama. A tough road lies ahead of them, and they must rely on each other to"
ordinaryreviews.com/star-wars-jedi-fallen-order-escape-the-train,"Star Wars (Jedi Fallen Order): Escape The Train Walkthrough. After the scrapyard part of the game, you have to escape the train and jump to Ceres ship.Heres a walkthrough of the train part in SW: Jedi Fallen Order."
pcgamer.com/slay-the-spire-the-watcher-4th-character,Slay the Spire The Watcher: how to play Slay the Spires 4th character . PC Gamer. The fourth character is live in Mega Crit Games card title: here are the most effective strategies to help you play Slay the Spire The Watcher
resourcepack.net/res/minecraft-1-18-1-resource-packs/page/8,Minecraft 1.18.1 Resource Packs . Texture Packs. A fairly large list of quality Minecraft 1.18.1 Resource Packs designed by various artists. Be sure to scroll through all the pages and you will surely find something that you will like.
shivsaga.com/top-10-yaoi-anime-on-funimation-2022,Top 10 Yaoi Anime On Funimation 2022. In this post we discuss Top 10 Yaoi Anime On Funimation. Check it out if you are big fan of yaoi anime and want to watch them on Funimation.
sirusgaming.com/how-to-get-the-song-of-resonance-in-lost-ark,How to Get the Song of Resonance in Lost Ark. The Song of Resonance is one of the songs that players can learn to play in Lost Ark. Songs are one of the many ways available for exploring the games
thegamereward.com/doubledown-casino-free-codes-collect-300000-free-chips-2569,"DoubleDown Casino Free Codes Collect 300,000 Free Chips - The Game Reward. This is dedicated to all DoubleDown Casino Fans to ease the collection of daily promo codes instead of visiting many sites. We will try our best to keep this"
woojr.com/summer-adult-coloring-pages/summer-toucan-printable-coloring,Summer Toucan Printable Coloring . Woo! Jr. Kids Activities : Childrens Publishing. Summer Toucan Printable Coloring
boardgamegeek.com/boardgame/307305/bullet,Bullet? . Board Game . BoardGameGeek. Space heroines defend Planet Earth in falling-block battles.
codycrossanswers.com/english-writer-known-for-his-arthurian-novels,"English writer known for his Arthurian novels - CodyCross Answers All Levels. Here are all the English writer known for his Arthurian novels answers. CodyCross is an addictive game developed by Fanatee. Are you looking for never-ending fun in this exciting logic-brain app? Each world has more than 20 groups with 5 puzzles each. Some of the worlds are: Planet Earth, Under The Sea, Inventions, Seasons, Circus, ...Continue reading English writer known for his Arthurian novels"
consumergearguide.com/best-phones-for-genshin-impact,13 Best Phones for Genshin Impact in 2022 (New Picks) - Consumer Gear Guide. On the hunt for the best phones for playing Genshin Imapact without a hitch? This guide will help you to make good choices.
games.ca.zone.msn.com/en/msmahjong/default.htm,"MSN - Game Landing Page. Play the best free games, deluxe downloads, puzzle games, word and trivia games,multiplayer card and board games, action and arcade games, poker and casino games, pop culturegames and more. MSN Games has it all."
mariowiki.com/koopa_(species),"Koopa (species) - Super Mario Wiki, the Mario encyclopedia. Koopas represent a consistent group of turtle-like creatures. There are many different types of Koopas, the most common being Koopa Troopas. Most Koopas operate in a hierarchy-based grouping system. Bowser is the leader of the Koopa Troop, which has invaded Mushroom Kingdom many times and has control..."
mtggoldfish.com/index/uz,Urzas Saga MTG MTGO Price History. Urzas Saga prices for Magic the Gathering (MTG) and Magic the Gathering Online (MTGO).
myanimelist.net/anime/2471/doraemon_1979,"Doraemon (1979) (Doraemon) - MyAnimeList.net. Looking for information on the anime Doraemon (1979) (Doraemon)? Find out more with MyAnimeList, the worlds most active online anime and manga community and database. Nobita Nobi is a normal fourth grade student. This all changes, however, when a blue robotic cat appears from his desk drawer. Calling himself Doraemon, this robot tells Nobita that his future descendants from the 22nd century live in poverty because of all the mistakes he made. Therefo"
myanimelist.net/anime/51544/suisei_no_freyline__prologue,"Suisei no Freyline: Prologue - MyAnimeList.net. Looking for information on the anime Suisei no Freyline: Prologue? Find out more with MyAnimeList, the worlds most active online anime and manga community and database. The anime centers on Morita, a boy who is transported to another world and takes on the task of saving it by becoming an idol producer to fairies and demi-humans. (Source: ANN)"
polygon.com/2019/11/22/20978174/where-to-find-buy-tms-technical-machines,"Where to find and buy TMs in Pokemon Sword and Shield - Polygon. In Pokemon Sword and Shield, all TMs can be either found on the floor, designated by a yellow Poke Ball, or bought in shops."
sportskeeda.com/minecraft/full-list-dream-minecraft-smp-members-2021,"Full list of Dream Minecraft SMP members in 2021. The Dream SMP Minecraft server is a whitelisted and completely private Minecraft world in which the popular Minecraft YouTuber Dream and his group of friends known as the ""Dream Team"" play."
themahjong.com/mahjong/turtle-free-mahjong,"Turtle Mahjong - free online Mahjong Solitaire games. Turtle mahjong: Amazing free Mahjong thatll knock your socks off. Play classic and modern Mahjong games in full screen, with lots of layouts and beautiful tiles."
uploadvr.com/preys-vr-support-is-a-polished-underwhelming-escape-room-campaign,"Preys VR Support Is A Polished, Underwhelming Escape Room Campaign. Despite coming from the publisher of some of VRs biggest games, Preys VR support is a pale imitation of the main games campaign."
wowhead.com/guides/exploration/wod/rares-and-treasures-in-gorgrond,"Rares and Treasures in Gorgrond - Guides - Wowhead. This guide takes a look at the rare spawns, objects, and achievements tied to rare spawns in Gorgrond."
wowhead.com/npc=184395/toadious,Toadious - NPC - World of Warcraft. Toadious is a level 60 NPC that can be found in Zereth Mortis. This NPC can be found in Zereth Mortis. In the NPCs category. Added in World of Warcraft: Shadowlands.
blueberries.gg/weapons/destiny-2-last-wish-loot-table,Destiny 2 Last Wish Loot Table: Raid Weapons & Armor. Many continue to farm the Last Wish raid for the many excellent weapons and great-looking armor it has to offer. This loot table covers it all.
domino.com/content/yucca-valley-home,A Yucca Valley Retreat Where Road Runners Roam and Tile Rules. Tour a Yucca Valley home thats covered in colorful tiles and has clever renovation hacks (like a DIY pergola) to spare.
eurogamer.net/articles/2022-03-17-apex-legends-mobile-getting-full-launch-on-ios-and-android-this-summer,"Apex Legends Mobile getting full launch on iOS and Android this ""summer"" . Eurogamer.net. Weve known for a while that Respawn Entertainments free-to-play battle royale shooter was edging toward its global re..."
eurogamer.net/articles/2022-03-17-apex-legends-mobile-getting-full-launch-on-ios-and-android-this-summer,"Apex Legends Mobile getting full launch on iOS and Android this ""summer"" . Eurogamer.net. Weve known for a while that Respawn Entertainments free-to-play battle royale shooter was edging toward its global re..."
evilresource.com/resident-evil-remake/enemies,Enemies (Resident Evil Remake) . Evil Resource. A full list of enemies for Resident Evil Remake.
gamebanana.com/mods/362081,"Tails from Sonic Rhythm Rush Friday Night Funkin Mods. A Friday Night Funkin (FNF) Mod in the Skins category, submitted by Paveletor16"
indiegamebundles.com/free-steam-key-orwell-keeping-an-eye-on-you,"FREE STEAM KEY: Orwell: Keeping an Eye On You - Indie Game Bundles. (Prospective) Investigators, If you or your friends havent played Orwell: Keeping and Eye on You, you can get it free on Steam for the next 24 hours!"
kotaku.com/cd-projekt-red-apologizes-for-cyberpunk-2077-bugs-says-1846053290,"CD Projekt Red Apologizes For Cyberpunk 2077 Bugs, Says Its Avoiding Crunch On All Future Projects. In a video on Twitter and a Q&A posted on the companys website, CD Projekt Red co-founder Marcin Iwinski apologized for the state Cyberpunk 2077 launched in on consoles, shared a road map for updates to the game coming in the future, and said the studio would deliver these fixes ""without any obligatory overtime."""
legacy-wow.com/tbc-burning-crusade-classic-wow-addons/questie,"Questie. Questie, the Classic Quest Helper - For TBC Classic! Questie is a quest helper for World of Warcraft: Classic that adds your available quests, objectives, and turn-ins to your map so you can quest confidently. Questie adds useful information about objectives into tooltips for you and your party members, as well as icons to mobs ..."
memebase.cheezburger.com/videogames/page/7,"Video Games - Page 7 - video game memes, Pokemon GO - Cheezburger. Page 7 of 1154 - Video Game Memes"
myanimelist.net/anime/50916,"Arifureta Shokugyou de Sekai Saikyou 2nd Season Special - MyAnimeList.net. Looking for information on the anime Arifureta Shokugyou de Sekai Saikyou 2nd Season Special (From Common Job Class to the Strongest in the World 2nd Season)? Find out more with MyAnimeList, the worlds most active online anime and manga community and database. Unaired episode included in the first Blu-ray volume."
pcgamer.com/this-mod-adds-a-sci-fi-city-to-skyrim-special-edition,"This mod adds a sci-fi city to Skyrim Special Edition . PC Gamer. Plenty of Skyrim mods add new locations. Fantastical places like The Forgotten City, Falskaar, and Elsweyr. Fort Knox by Ripcat, a Skyrim Special Edition mod, adds a futuristic city complete with skyscrapers, neon signs, an industrial district, a shuttle to takes you to the beach, shops that sell guns and drugs, cops in riot gear, and, of course, a strip club with sexy robots.&#xA0;It&apos;s an update of an older mod called Aether"
polygon.com/ratchet-clank-rift-apart-guide/22458980/cordelion-kedaro-station-collectibles-armor-pod-gold-bolt-spybot-lorb-craiggerbear-locations-map,"Ratchet & Clank: Rift Apart all Cordelion Kedaro Station collectibles - Polygon. Find every Armor Pod, Gold Bolt, Spybot, Lorb, and CraiggerBear in Cordelion Kedaro Station. Polygons Ratchet & Clank: Rift Apart collectibles guide has locations, maps, and screenshots for all collectibles."
psu.com/news/the-division-2-quietly-launches-countdown-mode-which-sees-you-fighting-for-a-nuclear-power-plant,"The Division 2 Quietly Launches Countdown Mode, Which Sees You Fighting For A Nuclear Power Plant - PlayStation Universe. The Division 2 publisher Ubisoft has launched a new mode, Countdown."
rocketgames.io/top-speed-racing-3d,"Top Speed Racing 3D Game - Play Free Online Games on RocketGames.iO. Top Speed Racing 3D game is a multi-purpose car driving simulator game. The game consists of many different types of cars like super sport very fast cars, special design racing cars, or offroad cars. Most of the cars are unlocked and you should participate in car races to earn cash and diamonds to buy new cars."
southamptongolfclub.com/best-super-game-improvement-irons,Best Super Game Improvement Irons 2022 - The Expert Golf Website. Super Game Improvement Irons Are Perfect For Beginners And High Handicappers. Check Out The Very Best Choices In Golf Irons Here.
studystack.com/flashcard-2683357,"Free Science Flashcards about Sci. Ch 2 Lesson 4. Study free Science flashcards about Sci. Ch 2 Lesson 4 created by sconway to improve your grades. Matching game, word search puzzle, and hangman also available."
vgchartz.com/game/228750/turok,"Turok for All - Sales, Wiki, Release Dates, Review, Cheats, Walkthrough. VGChartz delivers comprehensive game chart coverage, including sales data, news, reviews, & game database for PS4, PS5, Xbox One, Series X, Nintendo Switch & PC"
wordchampionanswers.com/wow-level-437-answers,WOW Level 437 Answers - WCA. Here you may find all the WOW Level 437 Answers. This is a brand new game developed by FUGO Games and its already rocking the app stores for both iOS and Android. We totally understand the need of having answers for each specific level because some of the levels cannot be solved.
9to5mac.com/2015/09/11/heres-all-of-the-new-animated-emoji-in-watchos-2-gm-gallery,"See all of the new animated emoji in watchOS 2 GM Gallery - 9to5Mac. Not to be outdone by iOS 9.1s set of new emoji, watchOS 2 GM, released this past Wednesday following Apples press event, includes a little surprise of its own. Alongside a bunch of new watch face colors, dig into the animated emoji offered on the Apple Watch, and youll find 26 new options, ranging from faces sporting ..."
androidnewapps.com/gm-player,GM Player Reproductor Dark Play Ultima Version 2022. Potente reproductor de video con... Read more
codycrossanswers.com/runner-answers,Runner Answers - CodyCross Answers All Levels. Welcome to our site for Runner Answers. CodyCross is an addictive game developed by Fanatee. Are you looking for never-ending fun in this exciting logic-brain app? The newest feature from Codycross is that you can actually synchronize your gameplay and play it from another device. Simply login with Facebook and follow the instructions given to ...Continue reading Runner Answers
codycrossanswers.net/track-from-which-ships-are-launched-into-water,"Track from which ships are launched into water - CodyCross Answers Cheats and Solutions. Find out Track from which ships are launched into water Answers. CodyCross is a famous newly released game which is developed by Fanatee. It has many crosswords divided into different worlds and groups. Each world has more than 20 groups with 5 puzzles each. Some of the worlds are: Planet Earth, Under The Sea, Inventions, ...Continue reading Track from which ships are launched into water"
dailyslotsrewards.com/double-down-casino-free-chips-300000-link4-5,"Double Down Casino Free Chips 300,000 Link4 - Daily Slot Rewards. doubledown Free Chips and Promo Codes"
fanpop.com/clubs/jb-girl-27/forum,JB girl 27 Forum . Bulletin Board Discussion on Fanpop. A message board for fans of JB girl 27
finder.com.au/cheapest-copies-mario-strikers-battle-league-football,Cheapest copies of Mario Strikers: Battle League Football . Finder. The Mario franchise continues to expand with Mario Strikers: Battle League Football. Find out how to pre-order the cheapest copies online in Australia.
game8.co/games/final-fantasy-crystal-chronicles-remastered/archives/292998,"Story Walkthrough and All Dungeons Guides . Final Fantasy Crystal Chronicles.Game8. This is our complete walkthrough and guide to the story of Final Fantasy Crystal Chronicles: Remastered Edition (FFCC). Learn the basic steps to get through the entire game, with guides on how to beat each dungeon, and tips and tricks for getting through the game!"
game8.co/games/genshin-impact/archives/301831,"How to Get Fish Cooking Ingredient . Genshin Impact.Game8. Fish is a Cooking Ingredient item in Genshin Impact. Learn how to use and where to find Fish cooking ingredient, where to buy Fish from shops and vendors, how to process Fish in cooking pots, its rarity and effects, and everything you need to know about the cooking ingredient Fish here!"
gamebanana.com/mods/335408,"Speedster Mania Sonic Mania Mods. Speedster Mania... A Sonic Mania (SM) Mod in the Character Modification category, submitted by DR3Y"
gamesradar.com/the-new-tomb-raider-could-be-a-reimaging-of-laras-first-adventure-but-some-fans-arent-convinced,"The new Tomb Raider could be a reimaging of Laras first adventure, but some fans arent convinced . GamesRadar. Is Crystal Dynamics looking to the past for inspiration?"
ign.com/videos/elden-ring-gameplay-walkthrough-volcano-manor-prison-town-church-24,"Volcano Manor: Prison Town Church (24) - Elden Ring Gameplay Walkthrough - IGN. This Elden Ring gameplay walkthrough will show you how to proceed from the Prison Town Church Site of Grace to the Guest House Site of Grace. 00:00 - How to reach the Guest House 11:56 - Optional: Exploring the Prison Town 14:00 - Optional: Exploring under the Prison Town 16:29 - Optional: Find the Crimson Amber Medallion 1 For our interactive map, dungeon walkthroughs and so much more, head to our guide on IGN.com. "
ign.com/wikis/watch-dogs-legion/walkthrough,"Walkthrough - Watch Dogs Legion Wiki Guide - IGN. IGN&apos;s Watch Dogs: Legion complete strategy guide and walkthrough will lead you through every step of the game from the title screen to the final credits,"
lostarkcodex.com/us/sailor/730015,Tasha - Sailors - Lost Ark Codex. Lost Ark Codex - the most complete and up to date database for the game!
m.republicworld.com/technology-news/gaming/coin-master-free-spins-and-coins-todays-links-7-april-2022-check-how-to-get-free-spins-articleshow.html,Coin Master Free Spins & Coins (Todays Links 7 April 2022): Check How To Get Free Spins. Build your Coin Master village by spinning the free slot machines & collecting enough coins for your upgrades. Check daily free spin links for 7 April.
nordic.ign.com/days-gone/24656/review/days-gone-review,"Days Gone Review. Frantic hordes of zombies cant save Days Gone from its repetitive gameplay, bland world, and meandering story."
polygon.com/tiny-tina-wonderlands-guide-walkthrough/22995128/beginners-tips-tricks-class-manufacturer-upgrades-damage-types,"6 tips and tricks for Tiny Tinas Wonderlands beginners - Polygon. Tiny Tinas Wonderlands is similar to other Borderlands Games, but there are a lot of differences that can give you a hard time. Our guide is here to help."
selphie1999gaming.com/game-guides/lego-star-wars-the-skywalker-saga-all-this-is-some-rescue-mission-challenges-guide,"LEGO Star Wars : The Skywalker Saga - All This Is Some Rescue Mission Challenges Guide. The This Is Some Rescue mission features a total of 3 different mission challenges, this includes Special Edition, Bullseye, and For Luck MISSION CHALLENGE: Special EditionDESCRIPTION: Discover the hidden room within the Death StarGUIDE: Get the Docking Bay password and explode the wall by the troopers and continue on. Here you will come across various scenes and enemy troopers, one ..."
wordchampionanswers.com/wow-level-395-answers,WOW Level 395 Answers - WCA. Here you may find all the WOW Level 395 Answers. This is a brand new game developed by FUGO Games and its already rocking the app stores for both iOS and Android. We totally understand the need of having answers for each specific level because some of the levels cannot be solved.
50gameslike.com/best-games-by-type/strategy,"The Best Strategy Games. The best Strategy games you can play right now, comparing over 60 000 video games across all platforms and updated daily"
brainfall.com/quizzes/which-super-mario-bros-character-are-you/8,"Which ""Super Mario Bros."" Character Are You? . BrainFall. The Super Mario games follow Marios adventures, typically in the fictional Mushroom Kingdom. Follow along and see which character you are."
ccm.net/forum/affich-1140413-tetris-unlock-the-code-samsung,"Tetris unlock the code samsung Solved. Best answer: Hi, You must purchase the Tetris game in order to unlock it. Here at CCM, we dont provide help to unlock games that require a purchase...."
dailythemedcrossword.info/regular-02-march-2021-crossword,"Daily Themed Crossword 2 March 2021 crossword answers All levels. Find out all the latest answers and cheats for Daily Themed Crossword, an addictive crossword game - Updated 2022."
dnd5e.wikidot.com/wondrous-items:ftd,Magic Items: Fizbans Treasury of Dragons - DND 5th Edition. 
finder.com.au/ps5-pro-rumours-2022,"PlayStation 5 Pro: Everything we know so far (Updated) . Finder. There are serious rumblings that a new PlayStation console, the PS5 Pro, may be in the works. Heres everything you need to know."
gamebanana.com/mods/252836,"Mania Shadow Sonic 3 A.I.R. Mods. Shadow sprites edited to look like mania... A Sonic 3 A.I.R. (S3AIR) Mod in the Sonic category, submitted by JakeS2"
heavy.com/games/top-war-battle-game-tips-cheats-guide,"5 Top War: Battle Game Tips & Tricks You Need to Know . Heavy.com. Merge, battle, and build like a pro with this tips and tricks guide for Top War: Battle Game."
ign.com/articles/best-nintendo-switch-accessories,"Best Nintendo Switch Accessories 2022 - IGN. The Switch is pretty sweet as-is, but add in some accessories like a second Nintendo Switch dock, a screen protector, and a Switch Pro Controller makes it even better."
ign.com/wikis/horizon-2-forbidden-west/tallnecks,"Tallnecks - Horizon Forbidden West Wiki Guide - IGN. Tallnecks are a type of machine in Horizon Forbidden West. Aloy must find and scale them in order to unlock clouded sections of the Map, which also makes"
ign.com/wikis/pokemon-legends-arceus/roserade,"Roserade - Pokemon Legends: Arceus Wiki Guide - IGN. Roserade is a Grass- and Poison-type Pokemon and part of the Pokemon Legends: Arceus Hisui Pokedex. This Pokedex page covers how to get Roserade,"
marketwatch.com/games/shhs2022spring,"SHHS2022spring - Free stock market game - MarketWatch. SHHS2022spring - Free stock market game with community trading discussion, player rank, profiles, earnings game."
monstermmorpg.com/maps-grand-monster-capital,"Grand Monster Capital: Game Map of MonsterMMORPG, Route Id 519, Zone Mixed. Grand Monster Capital Game Map: Route Id: 519, Zone: Mixed. You can catch 0 different Monsters at this route of MonsterMMORPG game."
myanimelist.net/anime/49320/detective_conan_movie_25__halloween_no_hanayome,"Detective Conan Movie 25: Halloween no Hanayome - MyAnimeList.net. Looking for information on the anime Detective Conan Movie 25: Halloween no Hanayome? Find out more with MyAnimeList, the worlds most active online anime and manga community and database. The movie is set to be released during the Golden Week in 2022."
player.one/project-gorgon-latest-update-introduces-mounts-145447,"Project: Gorgon Latest Update Introduces Mounts . Player.One. Players can now learn how to ride a horse. Plus, the horse can also be used as extra storage, thanks to the saddlebag."
polygon.com/pokemon-legends-arceus-guide-pla/22899479/complete-pokedex-list-numbered-hisui-pokemon,"Pokemon Legends Arceus Pokedex guide - Polygon. If you have holes in your Pokemon Arceus: Legends Pokedex, we have a solution. Our guide lists out the complete Hisui Pokedex in Pokemon Arceus: Legends, so you can figure out what youre missing."
soundtrackradar.com/soundtrack-sonic-the-hedgehog,"Soundtrack: Sonic The Hedgehog - Listen to all 18 Songs. The music from the movie ""Sonic The Hedgehog"". Altogether 19 songs can be heard in the action film. Each song is equipped with a scene description."
10scopes.com/best-ryzen-5-5600x-gaming-build,"Best Ryzen 5 5600X PC: Complete Gaming Build 2022. If youre confused about the best Ryzen 5600X PC build, no need to worry."
