url,contents
codycrossanswers.net/out-of-steam,"Out of steam - CodyCross Answers Cheats and Solutions. Find out Out of steam Answer. CodyCross is a famous newly released game which is developed by Fanatee. It has many crosswords divided into different worlds and groups. Each world has more than 20 groups with 5 puzzles each. Some of the worlds are: Planet Earth, Under The Sea, Inventions, Seasons, Circus, Transports and Culinary ...Continue reading Out of steam"
endlessawesome.com/2021/03/17/top-8-pubg-characters-in-real-life,"Top 8 ""PUBG"" Characters In Real Life - Endless Awesome. PlayerUnknown Battleground received positive reviews from critics as it presented type of gameplay that could be approached by players of any skills. With that, here is PUBG Characters in real life."
eurogamer.net/authors/victoria-kennedy,Victoria Kennedy . Eurogamer.net. Bad puns and video games since 1999.
fanbyte.com/guides/division-2-mods,The Division 2 Mods Guide: How to Unlock Mods. Weapon mods in The Division 2 have been significantly overhauled. Mods are no longer part of the loot system.
gamebanana.com/mods/370476,"XIII Style Leona The King of Fighters XV Mods. Soup cans or Grenades?... A The King of Fighters XV (KOFXV) Mod in the Leona category, submitted by Snak64"
lexulous.com/v2/g/32693167,"Game #32693167 - Lexulous Word Game. A word game that is addictive & challenging! Play with friends, people across the world or in solo mode. App is available for all Apple and Android devices."
limitlesstcg.com/cards/fst/179,Morpeko - Fusion Strike (FST) #179 - Limitless. A multi-language Pokemon TCG card database with advanced search features and up-to-date pricing data.
mangakatana.com/manga/detective-conan.436/c1091,"Chapter 1091: Crossover - Detective Conan. Read Chapter 1091: Crossover - Detective Conan online at MangaKatana. Support Two-page view feature, allows you to load all the pages at the same time"
manuals.ca/microsoft/age-of-empires-iii/manual,Microsoft Age of Empires III user manual (80 pages). Manual Microsoft Age of Empires III. View the Microsoft Age of Empires III manual for free or ask your question to other Microsoft Age of Empires III owners.
rpgbot.net/category/blog,"RPGBOT - Blog. Analysis, tools, instructional articles, and a podcast for tabletop RPGs"
sahmreviews.com/2020/09/looney-labs-marvel-jumanji-fluxx.html,Jumanji and Marvel Fluxx Card Game Overviews. Have a movie-themed game night by playing games inspired by movies. Our list includes card games like Marvel Fluxx and Jumanji Fluxx from Looney Labs.
sportskeeda.com/minecraft/how-download-install-minecraft-addons-xbox-one,"How to download and install Minecraft addons on Xbox One. Minecraft is a game that is distributed on many different platforms. From Windows to mobile and PlayStation 4, each platform has its own version or ""edition"" of Minecraft."
studystack.com/crossword-2488886,"Unfinished Crossword about Greece Vocabulary. Crossword puzzle for studying any subject. Matching game, word search puzzle, and hangman also available."
video-facts.com/en/play/b574qb/question/omnlwu,Catch the Creepy Bunny. Solve these fun and twisted Easter puzzles!
win.gg/news/which-spells-can-you-cast-in-hogwarts-legacy,Which spells can you cast in Hogwarts Legacy? - WIN.gg. Harry Potter fans magical knowledge will soon come in handy. A trailer has revealed some familiar spells to be cast in Hogwarts Legacy.
aiptcomics.com/2020/09/21/dc-comics-publishes-free-hbo-max-raised-by-wolves-1-comic,DC Comics publishes free HBO MaxRaised by Wolves #1 comic AIPT. You can read the Raised by Wolves digital comic across many available platforms.
bluetracker.gg/wow/topic/eu-en/23770463-hotfixes-april-5-2022,"Hotfixes: April 6, 2022 - Blue Tracker. Here you will find a list of hotfixes that address various issues related to World of Warcraft: Shadowlands, Burning Crusade Classic, and WoW Classic."
classic.wowhead.com/news/wow-classic-phase-3-class-quests-from-sunken-temple-temple-of-atalhakkar-311135,WoW Classic Phase 3 Class Quests from Sunken Temple (Temple of AtalHakkar) - Wowhead News. WoW Classic Sunken Temple (Temple of AtalHakkar) class quests are coming in Phase 3 along with Blackwing Lair.
codycrossanswers.com/barely-touching-the-surface-answers,"Barely touching the surface Answers - CodyCross Answers All Levels. Barely touching the surface Answers. CodyCross is an addictive game developed by Fanatee. Are you looking for never-ending fun in this exciting logic-brain app? Each world has more than 20 groups with 5 puzzles each. Some of the worlds are: Planet Earth, Under The Sea, Inventions, Seasons, Circus, Transports and Culinary Arts. We are sharing ...Continue reading Barely touching the surface Answers"
deckshop.pro/deck/detail/1118,"Golden Knight Hog cycle . Best Clash Royale decks, guides, tutorials, tips. Clash Royale deck information for ladder and tournaments. Counters, synergies, spell damages. Everything you need to know about your deck!"
gamesnostalgia.com/games/tag/science+fiction,GamesNostalgia - The best classic and old school Science Fiction games. 
gamesradar.com/joy-con-drift-fix,How to fix Joy-Con drift on the Nintendo Switch . GamesRadar. Are your sticks wandering? Heres how to fix the Nintendo Switch Joy-Con drift problem.
html5.gamedistribution.com/743a7b4719504058a598dc4b17b707ee,"Extreme Thumb War. We are carrying thumb war game which is a very popular game in daily life, to the devices. Pick one thumb character between more than twenty thumb character; and prove your skills against your friend or against CPU! There are two bars which are health bar and power bar in the game. You can smash your opponents finger until the power bar comes to end."
myanimelist.net/manga/128594/one_piece__episode_a,"One Piece: Episode A . Manga - MyAnimeList.net. Looking for information on the manga One Piece: Episode A? Find out more with MyAnimeList, the worlds most active online anime and manga community and database. The infamous Portgas D. Aces departure from Dawn Island marks the beginning of his pirate adventure, and he immediately finds himself deserted on an uninhabited, desolate island. There, he meets a mysterious man, who quickly becomes drawn to Aces personality and befriends him. Aiming to get"
studystack.com/flashcard-1271865,"Free Flashcards about TRICARE-REM. Study free flashcards about TRICARE-REM created by cameliaclark to improve your grades. Matching game, word search puzzle, and hangman also available."
svg.com/679869/marvels-spider-man-just-got-a-no-way-home-update-but-theres-a-catch,"Marvels Spider-Man Just Got A No Way Home Update, But Theres A Catch. Insomniac Games announced that new costumes from Spider-Man: No Way Home would not appear in the PS4 version of Marvels Spider-Man, and fans are furious."
tbc.wowhead.com/npc=22997/flame-of-azzinoth,Flame of Azzinoth - NPC - TBC Classic. Flame of Azzinoth is an Elite NPC that can be found in Black Temple. In the NPCs category. Added in World of Warcraft: The Burning Crusade. Always up to date.
thebingeful.com/best-interactive-story-games-for-switch,14 Best Interactive Story Games for Nintendo Switch. Storytelling and narrative can be equally as vital as realistic graphics or gameplay. These are the best interactive story games for Switch.
xfire.com/chronological-order-of-all-far-cry-games,"Chronological Order of All Far Cry Games - Xfire. The Far Cry franchise is one of the most well-known names when it comes to video games, thanks to its exotic settings and lunatic (yet lovable) villains. The chronology of the main series is pretty straight forward, theyre set in the year they were released in. While there isnt a lot of confusion surrounding the..."
businessinsider.com/walt-disney-world-rides-pay-skip-the-line-2021-10,"Walt Disney World Rides Where Youll Pay to Skip-the-Line. The company announced it would be launching its new Genie feature, which includes lightning lanes, where you can pay to skip ride queues."
buzzfeed.com/potterxhead/the-gryffindor-quiz-95u8hn1x2m,"Harry Potter Gryffindor Trivia Quiz. Slytherins, Hufflepuffs, and Ravenclaws keep scrolling."
crosswordtracker.com/clue/queen-of-mystery,Queen of mystery - crossword puzzle clue. Queen of mystery is a crossword puzzle clue
eurogamer.net/destiny-2-extraction-metamorphosis-sepulcher-9009,"Destiny 2 - Extraction, Metamorphosis and Sepulcher locations . Eurogamer.net. Where to find Witch Queen Lost Sector locations Extraction, Metamorphosis and Sepulcher within Quagmire, Miasma and Fluorescent Canal in Destiny 2."
grabcraft.com/minecraft/houses/sort/price1,"Houses - Blueprints for MineCraft Houses, Castles, Towers, and more . GrabCraft. This is page where all your Minecraft objects, builds, blueprints and objects come together. See how it is made!"
leagueofgraphs.com/summoner/kr/jaja diff,"JAJA DIFF (KR) - LeagueOfGraphs. We track the millions of LoL games played every day to gather champion stats, matchups, builds & summoner rankings, as well as champion stats, popularity, winrate, teams rankings, best items and spells."
lexulous.com/v2/g/32681669,"Game #32681669 - Lexulous Word Game. A word game that is addictive & challenging! Play with friends, people across the world or in solo mode. App is available for all Apple and Android devices."
lexulous.com/v2/g/32736085,"Game #32736085 - Lexulous Word Game. A word game that is addictive & challenging! Play with friends, people across the world or in solo mode. App is available for all Apple and Android devices."
mariowiki.com/list_of_beanholes_in_mario_&_luigi:_bowser's_inside_story,"List of beanholes in Mario & Luigi: Bowsers Inside Story - Super Mario Wiki, the Mario encyclopedia. In Mario & Luigi: Bowsers Inside Story, Mario and Luigi can collect Beans from beanholes - flashing dots underground in Bowsers body and X-shaped bean spots on the ground of the overworld - by using Drill Bros. and jumping out at the spots. There are 251 beans in total, though some are collected from..."
mut.gg/players/9836-everson-griffen/22-10509836,"Everson Griffen Power Up 78 OVR - Madden NFL 22 - MUT.GG. Check out the Everson Griffen Power Up 78 item on Madden NFL 22 - Ratings, Prices and more!"
op.gg/champions/ziggs/adc/skills,"Ziggs Build, Runes, Counters (Bottom, Season 12.6) - OP.GG - League of Legends. Ziggs Build for Bottom - Ziggs build from runes, skill order, item path, counters and more in the latest LoL Patch."
songsterr.com/a/wsa/tenacious-d-the-metal-tab-s23619,The Metal Tab by Tenacious D . Songsterr Tabs with Rhythm. The Metal Tab by Tenacious D with free online tab player. One accurate version. Recommended by The Wall Street Journal
spikeybits.com/2021/11/creating-your-first-characters-in-brutality-skirmish-wargame.html,Creating Your First characters In Brutality Skirmish Wargame. Today well be taking a look at creating your own characters in Brutality the Skirmish Wargame that seems to be pretty fun to play!
trucksbook.eu/index,Home Page . TrucksBook. TrucksBook is a system for players and virtual companies using Euro Truck Simulator 2 and American Truck Simulator.
ultraboardgames.com/mancala/index.php,"Mancala Fan Site . UltraBoardGames. All information about boardgames. Reviews, tips, game rules, videos and links to the best board games, tabletop and card games."
venturebeat.com/2021/09/29/supersocial-raises-5-2m-to-make-games-for-the-roblox-metaverse,Supersocial raises 5.2M to make games for the Roblox metaverse . VentureBeat. Supersocial has raised 5.2 million to make games and immersive experiences for Roblox and anything else that calls itself the metaverse.
allthetests.com/tests-for-the-real-fan/games-quizzes/assassins-creed/index.php,Are you the pro in Assassins Creed? - AllTheTests.com. You know everything about the game Assassins Creed? You have played it hundreds of times? No one can fool you? Test yourself now!
bleedingcool.com/games/pokemon-tcg-celebrations-products-promos-guide,Pokemon TCG: Celebrations Products & Promos Guide. There are 18 promo cards that can be collected in Pokemon TCG: Celebrations products. Here is where collectors can find each of these cards.
classic.wowhead.com/npc=15275/emperor-veknilash,Emperor Veknilash - NPC - Classic World of Warcraft. Emperor Veknilash is a boss that can be found in AhnQiraj. In the NPCs category. Added in Classic World of Warcraft. Always up to date with the latest patch.
codycrossanswers.net/six-pointed-geometric-figure,"Six-pointed Geometric Figure - CodyCross Answers Cheats and Solutions. Find out Six-pointed geometric figure Answers. CodyCross is a famous newly released game which is developed by Fanatee. It has many crosswords divided into different worlds and groups. Each world has more than 20 groups with 5 puzzles each. Some of the worlds are: Planet Earth, Under The Sea, Inventions, Seasons, Circus, Transports and Culinary ...Continue reading Six-pointed Geometric Figure"
download-free-games.com/mobile/flip-master,"Flip Master Game Review - Download and Play Free On iOS and Android. Flip Master is a simple sort of game with basic controls, an equally basic concept, and is actually tough to put down"
gameanswers.net/en/words-of-wonders/n-seoul-tower/level-1330,"(WOW) Words Of Wonders N seoul tower Level 1330 answers . All levels. Find out all the popular Words Of Wonders Answers, Cheats & Solutions for iPhone, iPad & Android. Simple search!"
gamebanana.com/mods/174176,"Dark Bowser (Texture) Super Smash Bros. Ultimate Mods. A Super Smash Bros. Ultimate (SSBU) Mod in the Bowser category, submitted by Nin10Doug"
gamesradar.com/au/lego-star-wars-the-skywalker-saga-review,"Lego Star Wars: The Skywalker Saga review: ""At last, THIS is the droid you are looking for"" . GamesRadar. After 17 years perfecting its formula, developer Traveller&#x2019;s Tales has returned to the game that started it all and decided to redo LEGO Star Wars. But &#x2018;redo&#x2019; doesn&#x2019;t do justice to the ambition here. This is a completely new game, recreating not only the original trilogy of films in LEGO form, but all nine films from the yellow text of A New Hope, through the &#x2"
gamesradar.com/guardians-of-the-galaxy-tips,"10 Guardians of the Galaxy tips to get paid and rock the Milano . GamesRadar. Everything you need to know for Guardians of the Galaxy combat, puzzles or choices"
gamewith.net/animal-crossing-new-horizons/article/show/17448,ACNH . Bunny Day Furniture List . Animal Crossing - GameWith. Check out this list of all Bunny Day items (furniture) you can get in Animal Crossing New Horizon Switch (ACNH). The guide includes Bunny Day recipes and how to get them!
gamewith.net/dragon-ball-z-kakarot/article/show/15001,"DBZ Kakarot . Field Maps - Areas & Details . Dragon Ball Z: Kakarot - GameWith. Check out this list guide about Field areas in DBZ Kakarot! Learn the maps in Dragon Ball Z Kakarot, special events, how to check for Frenzy or Villainous Enemies, and more!"
gamewith.net/genshin-impact/article/show/30023,"Moshiri Kara How To Unlock And Release Date . Genshin Impact - GameWith. Learn about the new Moshiri Kara domain in Genshin Impact. This guide includes domain information, rewards, and more in the upcoming 2.2 Update!"
gamewith.net/pokemon-legends-arceus/article/show/31364,"Incarnate Forces of Hisui: Request 94 . Pokemon Legends Arceus - GameWith. Incarnate Forces of Hisui is the request 94 for Pokemon Legends: Arceus. See unlock conditions, locations, & side-quest walkthrough."
inverse.com/gaming/monster-hunter-rise-longsword-build-best-armor-upgrades-spirit-gauge,"Monster Hunter Rise Longsword build: Best armor, weapon upgrades, and more. Everything you need to know to become a master of the Longsword, including optimal upgrades and armor pieces to make the most of the blades unique strengths."
studystack.com/flashcard-144615,"Free Laboratory Science Flashcards about Chemistry Review-SR. Study free Laboratory Science flashcards about Chemistry Review-SR created by sabrinaramirez to improve your grades. Matching game, word search puzzle, and hangman also available."
svg.com/102698/longest-boss-fights-ever-video-games,"The Longest Boss Fights Ever In Video Games. From intense action-packed fights to protracted battles lasting 18-plus hours, lets take a look at some of the longest boss fights ever in video games."
techspot.com/products/pc-games/guild-wars-2.83726,"Guild Wars 2 Reviews, Pros and Cons . TechSpot. Guild Wars 2 reviews, pros and cons. Liked: Allows you to summon a Mistfire Wolf. Fluid movement and combat are consistently entertaining. Disliked: Does a mediocre job of explaining important concepts."
uk.pcmag.com/god-of-war-for-playstation-4/118091/dark-souls-beginners-guide-8-tips-thatll-help-you-survive,"Dark Souls Beginners Guide: 8 Tips Thatll Help You Survive. If this is your first time playing Dark Souls, youll need all the help you can get. These tips and beginner build ideas will help get you started with Dark Souls: Remastered."
vipvideo.juicemobi.com/video/1545,"JuiceMobi. Watch kids like Nursery rhymes, kids songs videos, all in one! Learning and playing H5 games!"
wowroms.com/en/isos/playstation-portable/god-of-war-chains-of-olympus/33588.html,"God of War : Chains of Olympus - Playstation Portable (PSP) iso download . WoWroms.com. God of War : Chains of Olympus iso for Playstation Portable (PSP) and play God of War : Chains of Olympus on your devices windows pc , mac ,ios and android!"
codycrossanswers.com/almost-certainly-highly-probably,"Almost certainly highly probably - CodyCross Answers All Levels. Here are all the Almost certainly highly probably answers. CodyCross is an addictive game developed by Fanatee. Are you looking for never-ending fun in this exciting logic-brain app? Each world has more than 20 groups with 5 puzzles each. Some of the worlds are: Planet Earth, Under The Sea, Inventions, Seasons, Circus, Transports and Culinary ...Continue reading Almost certainly highly probably"
craftingagreenworld.com/articles/how-to-diy-giant-dice,"2 Ways to Make GIANT DICE!. Small store-bought dice are fine for small board games, but for GIANT games, you need GIANT dice!"
eurogamer.net/cyberpunk-2077-breathtaking-johnny-silverhand-items-5077,Cyberpunk 2077 Johnny Silverhand item locations: How to unlock the Breathtaking item set explained . Eurogamer.net. How to collect all items that once belonged to Johnny Silverhand in Cyberpunk 2077.
eurogamer.net/digitalfoundry-best-usb-sound-cards-for-gaming,"Best USB sound cards for gaming 2022 . Eurogamer.net. See Digital Foundrys recommend USB sound cards for gaming, based on our extensive testing and featuring the likes of Epos and Creative Sound Blaster."
gamebanana.com/mods/cats/7534,Link Super Smash Bros. Ultimate Mods. Link Mods for Super Smash Bros. Ultimate (SSBU)
ign.com/articles/best-nintendo-switch-lite-accessories,Best Nintendo Switch Lite Accessories 2022 - IGN. Here are the Nintendo Switch Accessories we know will work with the Nintendo Switch Lite.
inverse.com/gaming/hades-symbol-meaning-guide-hera-dionysus-apollo-ares-aphrodite,Hades symbols guide: Heres what every door and Boon symbol means. Supergiant Games sleeper hit roguelike Hades uses a lot of symbols to represent different things. Heres what they all mean.
musicradar.com/news/sampleradar-free-80s-pop-drums-samples,"SampleRadar: 183 free 80s pop drums samples . MusicRadar. Its gated snares galore in our next free sample pack, which collects four drum kits perfect for an 80s pop sound"
sporcle.com/challenge/2,Sporcle Challenges. The best trivia quizzes on the internet on every topic imaginable.
classic.wowhead.com/npc=15541/twilight-marauder-morna,Twilight Marauder Morna - NPC - Classic World of Warcraft. Twilight Marauder Morna is a level 60 Elite NPC that can be found in Silithus. This NPC is the objective of Twilight Marauders. In the NPCs category.
dosgamesarchive.com/download/overkill,"Download OverKill . DOS Games Archive. OverKill is a fast-action arcade game. On your journey through this shareware version, youll visit the first two planets in the six-planet OverKill saga..."
en.uesp.net/wiki/skyrim:comberry,Skyrim:Comberry - The Unofficial Elder Scrolls Pages (UESP). 
fandomspot.com/sims4-monster-cc,Sims 4 Monster CC & Mods For Custom Creatures - FandomSpot. You can already do some pretty amazing things with Create-A-Sim. But throw Custom Content into the mix and you can get even crazier. Its fitting that a life...
gamebanana.com/mods/51364,"A Alternative to trade evolution Pokemon Sword & Shield Mods. A Alternative to trade evolve... A Pokemon Sword &amp; Shield (SWSH) Mod in the Tweaks category, submitted by Itreax"
gamewith.net/genshin-impact/article/show/32919,"Perils In The Dark World Quest Guide . Ring The Two Bells . Genshin Impact - GameWith. Perils In The Dark is a world quest for Genshin Impact 2.6. Guide contains how to start, walkthrough, puzzles, ring the two bells, solutions, The Chasm. how to unlock, & rewards."
rolimons.com/player/1209322865,"finshsgaming . Profile . Rolimons. finshsgaming is a player on Roblox. See their Value, RAP, Limiteds, Trade Ads and more at Rolimons!"
slashgear.com/lego-mindstorms-diy-shirt-folding-robot-breaks-cover-11107062,Lego Mindstorms DIY shirt folding robot breaks cover - SlashGear. I like Lego and played with them a lot as a kid. I typically built things like guns or cars that I would then proceed...
sporcle.com/games/quizbetterthanu/better-top-100-mlb-players-2022,Better Top 100 MLB Players (2022) Quiz - By quizbetterthanu. Can you name the Better Top 100 MLB Players (2022)?
techradar.com/gaming/reviews,"Game reviews for PC, Xbox, PS5 and Switch . TechRadar Gaming. Game reviews for PC, Xbox, PS5 and Switch"
video-facts.com/en/play/55ouhe/question/xhe15b,Match the cards!. Play this simple card game and see how high you can score.
aiptcomics.com/2022/03/03/mat-groom-power-rangers-boom-2022,New Power Rangers creative kicks off with Mighty Morphin #17 AIPT. The Mighty Morphin team must band together with New Green Ranger Matt and former Ranger Grace Sterling to rebuild their Command Center.
born2invest.com/articles/lottery/jackpot-time-here-are-todays-saturday-april-9-2022-classic-lotto-results-and-winning-numbers,"Jackpot time? Here are todays (Saturday April 9, 2022) Classic Lotto results and winning numbers. - Born2Invest. The Classic Lotto results are in! Did you win on Saturday April 9, 2022? Find out within seconds and optimize your chances for success in future drawings."
classic.wowhead.com/guides/mage-dps-talents-builds-classic-wow,"Mage DPS Talents & Builds Guide - WoW Classic Season of Mastery - Guides - Wowhead. Best Mage DPS talent builds and specs for every PvE and PvP situation in Classic WoW, as well as detailed information about each talent and when to pick them."
dogsquiz.com/wpqquestion/the-border-terrier-is-not-good-at-escaping-skills,Dogs Quiz - Play Dogs Quiz & Trivia Daily!. Play Dogs Quiz & Trivia Daily!
download-free-games.com/mobile/1941-frozen-front,"1941 Frozen Front - Download and Play Free On iOS and Android. Play 1941: Frozen Front and outmaneuver the enemy forces using your infantry, tanks and aircraft in this highly tactical turn-based strategy game"
futhead.com/22/players/111/jack-grealish,"Jack Grealish FIFA 22 - 84 - Prices and Rating - Ultimate Team . Futhead. Jack Grealish 84 - live prices, in-game stats, comments and reviews for FIFA 22 Ultimate Team FUT. Join the discussion or compare with others!"
hiconsumption.com/best-video-games-of-all-time,The 100 Best Video Games of All Time . HiConsumption. Ready? Fight!
knowtechie.com/best-buy-has-some-must-have-switch-games-on-sale-right-now,"Best Buy has some must-have Switch games on sale right now. For Nintendo Switch games, Best Buy is the best place to go right now. This limited-time sale is why. Learn more here."
mobafire.com/league-of-legends/build/hail-of-blades-pyke-support-552396,Pyke Build Guide : Hail of Blades Pyke Support :: League of Legends Strategy Builds. Hail of Blades Pyke Support . Pyke build guides on MOBAFire. League of Legends Premiere Pyke Strategy Builds and Tools.
player.one/ascent-transmogrification-feature-now-available-144158,"The Ascent: Transmogrification Feature Now Available . Player.One. The developers also added new fashion items, which you can use in Photo Mode and the Transmogrification feature."
ranker.com/crowdranked-list/greatest-movie-themes,"The Most Famous Movie Theme Songs, Ranked By Fans. The best movie theme songs are usually from famous movies. But which movie theme song should be at the top of the list? Vote up your favorite theme songs!"
record-of-ragnarok.online/manga/record-of-ragnarok-chapter-53,"Record of Ragnarok, Chapter 53 - English Scans. Read Record of Ragnarok, Chapter 53 Read Record of Ragnarok Manga Online - High quality English chapter scans."
refinery29.com/en-us/2019/08/240810/netflix-mindhunter-season-2-soundtrack-list,"All The Songs From Netflix Mindhunter Season 2. Get ready to add all the killer songs from ""Mindhunter"" season 2 to your playlists."
resourcepack.net/res/minecraft-1-16-resource-packs/page/4,Minecraft 1.16 Resource Packs . Texture Packs. A fairly large list of quality Minecraft 1.16 Resource Packs designed by various artists. Be sure to scroll through all the pages and you will surely find something that you will like.
spikeybits.com/2019/09/pack-roll-foldable-tournament-cart-review.html,Pack & Roll Foldable Tournament Cart For Miniatures: Review. Dont sleep on this latest hobby product to help transport your miniatures! The Pack and Roll Cart is super lightweight and portable. Perfect for wargaming!
techspot.com/downloads/7311-eve-online.html,"EVE Online 2022.04-07.1 Download . TechSpot. Download EVE Online - EVE Online is a community-driven spaceship MMO where players can play free, choosing their own path from countless options."
