url,contents
comicbook.com/gaming/news/elden-ring-final-boss-elden-beast-video-ddr-dance-pad,"Elden Ring Player Beats the Final Boss Using DDR Dance Pad. Since the games debut earlier this year, Elden Ring has given players a significant amount of difficulty. However, some players like to add an extra level of challenge for themselves. For example, Reddit user Ugoroszczak decided that beating Radagon and the Elden Beast alone wasnt difficult ..."
deckshop.pro/deck/detail/913,"X-Bow eWiz cycle . Best Clash Royale decks, guides, tutorials, tips. Clash Royale deck information for ladder and tournaments. Counters, synergies, spell damages. Everything you need to know about your deck!"
gamebanana.com/mods/33976,"SH Essentials: Widescreen Revamp Sonic Heroes Mods. we have it, boys. the widescreen!... A Sonic Heroes (SH) Mod in the OtherMisc category, submitted by Raphael Drew Boltman and SH Essentials"
getandroidly.com/anime-games/one-piece-treasure-cruise/best-team-optc,One Piece Treasure Cruise: Best Team 2022 . GetAndroidly. One piece Treasure Cruise is a role-playing game by Bandai Namco Entertainment Company that allows you to take the role of a famous anime character and clear
hattrick.org//help/rules,Introduction Manual Help Hattrick. The original and the most popular online football manager game. Its free to play - everybody deserves their own football team!
jigidi.com/jigsaw-puzzle/bc3tcyk5/number-806-tessellation-400,Solve Number 806 tessellation 400 jigsaw puzzle online with 400 pieces. Challenge yourself with this Number 806 tessellation 400 jigsaw puzzle for free. 96 others took a break from the world and solved it
marketwatch.com/games/superawesome/portfolio,"Portfolio - SuperAwesome - Free stock market game - MarketWatch. SuperAwesome - Free stock market game with community trading discussion, player rank, profiles, earnings game."
mejoress.com/en/all-roblox-games-codes-promocodes/,"All Roblox Games Codes & Promocodes -. Here you will find All Roblox Games Codes & Promocodes, a list with all the games where you can search the game you want and find all the"
mobafire.com/league-of-legends/build/riofacerrs-yasuo-adc-guide-the-way-of-melee-adc-584884,Yasuo Build Guide : Riofacerrs Yasuo ADC Guide . The Way of Melee ADC :: League of Legends Strategy Builds. Riofacerrs Yasuo ADC Guide . The Way of Melee ADC . Yasuo build guides on MOBAFire. League of Legends Premiere Yasuo Strategy Builds and Tools.
nintendosoup.com/random-check-out-squirdle-a-fanmade-pokemon-themed-wordle-like,"Random: Check Out Squirdle, A Fanmade Pokemon Themed Wordle-Like - NintendoSoup. For the past few months, the puzzle game Wordle has taken the internet by storm, based on the surprisingly simple premise of guessing a five letter word with hints based on colored tiles. Read more"
pcgamer.com/au/elden-ring-cheats,"Elden Ring cheats: how to cheat while offline . PC Gamer. There are no official cheat codes for Elden Ring, so cheating in the Lands Between requires extra mods."
puzzle-loop.com/print.php,Slither Link - online puzzle game. Play online Slither Link the puzzle game also known as Loop The Loop or Fences
sportskeeda.com/free-fire/how-get-free-diamonds-garena-free-fire-max-india-april-2022-guide,"How to get free diamonds in Garena Free Fire MAX in India (April 2022 guide). With diamonds, users may obtain a broad array of in-game items from the store and can also engage in various events in Free Fire MAX."
uploadvr.com/medal-of-honor-vr-above-beyond-multiplayer-game-modes,"Everything You Need To Know About Medal of Honor VR Multiplayer. Weve rounded up everything you need to know about Medal of Honor: Above and Beyond multiplayer game modes, weapons, maps, and more!"
worddle-answers.com/id-345.html,"Wordle answers Violin - 5 . All levels 2022 (Updated Daily). Find out all the popular Wordle Answers, Cheats & Solutions for iPhone, iPad & Android. Simple search!"
3dtextures.me/category/sci-fi,Sci-fi . 3D TEXTURES. Posts about Sci-fi written by Katsukagi
apkcombo.com/category,Categories Games & Apps (Android). Categories Games & Apps (Android)
calculator.net/dice-roller.html,Dice Roller. Online virtual dice roller that is capable of simultaneously rolling up to 100 dice randomly. A virtual dice roller with any number of sides is also provided.
classic.wowhead.com/item=19030/stormpike-battle-charger,Stormpike Battle Charger - Item - Classic World of Warcraft. A mount collection item. It is sold by NPCs. In the Mount Items category. Added in Classic World of Warcraft. Always up to date with the latest patch.
codycrossanswers.net/type-of-bacteria-that-do-not-require-oxygen,"Type of bacteria that do not require oxygen - CodyCross Answers Cheats and Solutions. Find out Type of bacteria that do not require oxygen Answers. CodyCross is a famous newly released game which is developed by Fanatee. It has many crosswords divided into different worlds and groups. Each world has more than 20 groups with 5 puzzles each. Some of the worlds are: Planet Earth, Under The Sea, Inventions, ...Continue reading Type of bacteria that do not require oxygen"
comicbook.com/anime/amp/news/bleach-cosplay-yoruichi-best-girls-anime,Bleach Cosplay is Ready for Yoruichis Big Anime Return. 
digitaltrends.com/gaming/how-to-play-call-of-duty-mobile-on-pc-emulator-guide,"How to Play Call of Duty: Mobile on PC . Digital Trends. If your PC isnt up to the task of running Call of Duty: Warzone, playing Call of Duty: Mobile on your PC is the next best thing. Theres an emulator for that."
eurogamer.net/sonys-ghost-of-tsushima-movie-adaptation-names-its-writer,"Sonys Ghost of Tsushima movie adaptation names its writer . Eurogamer.net. Last March, John Wick director Chad Stahelski announced he was working on a movie adaptation of PlayStation samurai adv..."
fanbyte.com/guides/smash-ultimate-game-watch-guide,"Smash Ultimate Game and Watch Guide - Moves, Outfits, & More. This is a Smash Ultimate Game and Watch guide! Learn their moves, outfits, strengths, and weaknesses right here!"
filmjabber.com/movie-synopsis/star-wars-episode-iv-a-new-hope.html,"Star Wars: Episode IV: A New Hope Movie Synopsis, Summary, Plot & Film Details. Read the movie synopsis of Star Wars: Episode IV: A New Hope to learn about the film details and plot. FilmJabber is your source for film and movies."
hellsparadise.online/comic/hells-paradise-chapter-46,"Hells Paradise Chapter 46 - hells Paradise manga online. Hells Paradise 46, Jigokuraku 46, Hells Paradise Chapter 46, Read Hells Paradise Read Hells Paradise Manga Online in High Quality Free Manga Hells Paradise - Read Hells Paradise Manga Online , Best Manga Online in High Quality."
houseofkingdoms.com/rise-of-kingdoms/guides-tips/best-kvk-commanders-f2p,Top 10 Best KvK Commanders for F2P Players - House of Kingdoms. 
letterboxd.com/film/sonic-the-hedgehog-2/reviews/by/activity/page/4,Reviews of Sonic the Hedgehog 2 Letterboxd. Reviews of Sonic the Hedgehog 2
mobafire.com/league-of-legends/ability/petricite-burst-904,"Petricite Burst :: Sylas Ability :: League of Legends. Sylas ability in LoL, Petricite Burst, at MOBAFire - premiere League of Legends strategy build guides and tools."
punchbowl.com/starwars,"Free Star Wars Invitations, Star Wars Online Invitations . Punchbowl. Exclusive Star Wars online invitations featuring all your favorite characters including Han Solo, Chewbacca, Rey, Finn, Kylo Ren, R2-D2, BB-8, and more. Looks like real stationery! Personalize beautiful, free Star Wars invitations for your party."
sirusgaming.com/lego-star-wars-the-skywalker-saga-level-challenges,LEGO Star Wars The Skywalker Saga Level Challenges. There are 135 LEGO Star Wars The Skywalker Saga level challenges in total. Below is the list of all the level challenges in LEGO Star Wars The Skywalker Saga.
steambunlightnovel.com/the-king-of-hells-genius-pampered-wife/chapter-611-hysterical-madness,Chapter 611: Hysterical Madness - Steam Bun Light Novel. 
vgchartz.com/game/223540/rune-factory-5,"Rune Factory 5 for Nintendo Switch - Sales, Wiki, Release Dates, Review, Cheats, Walkthrough. VGChartz delivers comprehensive game chart coverage, including sales data, news, reviews, & game database for PS4, PS5, Xbox One, Series X, Nintendo Switch & PC"
agame.com/game/stickman-fighter-epic-battle,"Play Stickman Fighter: Epic Battle online for Free on Agame. Theres no other battle like this on the entire internet! Stickman Fighter: Epic Battle will have you face off against menacing foes that will use amazing martial arts and fighting techniques, but you must prove that youre stronger!"
candycrushmom.com/level-3047,"Tips and Walkthrough: Candy Crush Level 3047. Candy crush level 3047 tips, strategy guide and a walkthrough video to complete this level easily."
codycrossanswers.com/country-representative-answers,"Country representative Answers - CodyCross Answers All Levels. Country representative Answers.Here are all the One of the days of the week answers. CodyCross is an addictive game developed by Fanatee. Are you looking for never-ending fun in this exciting logic-brain app? Each world has more than 20 groups with 5 puzzles each. Some of the worlds are: Planet Earth, Under The Sea, Inventions, ...Continue reading Country representative Answers"
comicbookroundup.com/comic-books/reviews/marvel-comics/x-deaths-of-wolverine-(2022)/4,"X Deaths Of Wolverine #4 Reviews (2022) at ComicBookRoundUp.com. Compare critic reviews for X Deaths Of Wolverine #4 by Ben Percy and Federico Vicentini, published by Marvel Comics."
dailyslotsrewards.com/double-down-casino-chips-250000-link9-38,"Double Down Casino Chips 250,000 Link9 - Daily Slot Rewards. doubledown Free Chips and Promo Codes"
en.uesp.net/wiki/lore:bloodthirst,Lore:Bloodthirst - The Unofficial Elder Scrolls Pages (UESP). 
gamesgames.com/game/hidden-objects-6-silver-keys,"Play Hidden Objects: 6 Silver Keys online on GamesGames. Rita and Monica are on an exciting adventure to find a long lost treasure. According to legend, it once belonged to Queen Sophie-Charlotte and it could be located in a mysterious chamber. Can you help them find the six silver keys theyll need to unlock i"
hunt4freebies.com/free-unlimited-bowling-game-for-oculus-quest-vr-systems,FREE Unlimited Bowling Game for Oculus Quest VR Systems - Hunt4Freebies. Get the FREE Unlimited Bowling Game for Oculus Quest VR Systems! Feel the joy and excitement of real bowling!
ign.com/videos/2022/01/06/bioware-provides-updates-on-new-mass-effect-dragon-age-games,"BioWare Provides Updates on New Mass Effect, Dragon Age Games - IGN. BioWare GM Gary McKay assured fans that their teams are hard at work on the next Mass Effect and Dragon Age games."
kotaku.com/i-finally-fixed-an-annoying-ps5-icon-glitch-1846568481,"I Finally Fixed An Annoying PS5 Icon Glitch. Late last year, I replayed Assassins Creed III via the remastered PS4 edition. I played it on my PS5 and after completing it, I deleted the game. Yet its digital ghost haunted my PS5 for months. Finally, this weekend, I removed it thanks to a random Twitter user and Greg Miller."
lexulous.com/v2/g/32953183,"Game #32953183 - Lexulous Word Game. A word game that is addictive & challenging! Play with friends, people across the world or in solo mode. App is available for all Apple and Android devices."
mariowiki.com/list_of_power_moons_in_the_lake_kingdom,"List of Power Moons in the Lake Kingdom - Super Mario Wiki, the Mario encyclopedia. This is a list of the 42 Power Moons that can be found in the Lake Kingdom of Super Mario Odyssey."
nintendosoup.com/super-nintendo-world-store-now-open-at-universal-studios-hollywood,Super Nintendo World Store Now Open At Universal Studios Hollywood - NintendoSoup. Universal Studios Hollywood has opened its first Super Nintendo World store at the park. Read more
softpedia.com/reviews/games/playstation-5/far-changing-tides-review-535032.shtml,FAR: Changing Tides Review (PS5). The perfect game for those looking to chill
superherojacked.com/2022/04/06/kanoh-agito-workout,"Kanoh Agito Workout Routine: Train like The Fifth Fang of Metsudo! - Superhero Jacked. BONUS: Its time to bring in another Kengan Ashura character and behemoth to our Anime Workouts. Weve already seen a couple other Kengan Ashura characters, and you guys are have been requesting tons since the announcement of another reason coming to Netflix. In preparation of more coming in to join Imai Cosmo and Ohma Tokita Ive already went ahead and set up our Kengan Ashura Inspired Workouts mini-database. We"
wired.com/story/history-drug-wars-calculator-game,"The Wild Spread of Drug Wars, From Your Calculator to Your Phone . WIRED. Originally a DOS game, it found a secret life on Texas Instruments calculators everywhere in the 90s, Now the game is available for a whole new generation."
wordcollectanswers.com/en/level-646.html,"Word Collect Level 646 answers. All packs puzzles. Find out all the latest Answers, Cheats & Solutions for Word Collect, the popular and challenging game of solving words. We will help you solve the words!"
7littlewordsanswers.com/period-of-three-years-7-little-words,Period of three years 7 Little Words Bonus - 7LittleWordsAnswers.com. Below you will find the solution for: Period of three years 7 Little Words which contains 9 Letters.
avforums.com/threads/daleks-invasion-earth-2150-a-d-1966-collectors-edition-4k-uhd.2407289,"Daleks Invasion Earth 2150 A.D. (1966) Collectors Edition 4K UHD . AVForums. Links: Amazon.co.uk - HMV - Zavvi Release date: 18072022 Includes: 4K UHD and Blu-ray disc, a booklet with new essays, an exclusive 32-page version..."
avforums.com/threads/your-uhd-blu-ray-wishlist.2055400/page-23,Your UHD Blu-Ray Wishlist . Page 23 . AVForums. The Last Samurai.
boardgamegeek.com/boardgame/322589/zapotec,"Zapotec . Board Game . BoardGameGeek. Through card play and resource management, contribute to the rise of the Zapotec."
bokksu.com/pages/first-box-sakura-season,"Bokksu Japanese Snack Subscription - First Box Sakura Season. Discover the seasonal flavors of Japan with your first Bokksu Japanese snack subscription box! Full of authentic Japanese snacks that cant be found anywhere else, get started with your first box today!"
coolmath.com/algebra/20-combinatorics/01-counting-principals-03,"Fast Counting 3. Fast Counting 3 - Cool Math has free online cool math lessons, cool math games and fun math activities. Really clear math lessons (pre-algebra, algebra, precalculus), cool math games, online graphing calculators, geometry art, fractals, polyhedra, parents and teachers areas too."
digitaltrends.com/gaming/best-ps-vita-games,"The Best PS Vita Games of All Time . Digital Trends. Looking for something for your PS Vita? Here are some perfect titles, including genres such as shooters, role-playing games, platformers, and action games."
gamedotro.com/10-games-like-forge-of-empires-android-ios,Top 10 Games Like Forge of Empires for Android & IOS. Looking for Games Like Forge of Empires to play on your Android or IOS? Here have best RTS Strange World Shadows of Empires Bad North...
goatformat.com/home/archives/03-2022,Blog-Archiv - Yu-Gi-Oh! Goat Format. The worlds most prestigious Goat Format tournament series returns on April 23-24th with GFC 17. As always the Goat Format Championships are FREE entry. Check out these amazing prizes below. Thank...
gottabemobile.com/best-nintendo-switch-cases-covers-skins,"The Best Nintendo Switch Cases & Covers. Youll want to purchase one of the best Nintendo Switch cases, sleeves, covers and bags to shield your Nintendo Switch from harm."
lexulous.com/v2/g/32880102,"Game #32880102 - Lexulous Word Game. A word game that is addictive & challenging! Play with friends, people across the world or in solo mode. App is available for all Apple and Android devices."
ptr.wowhead.com/spell=365055/genesis-crawler,Genesis Crawler - Spell - 9.2.5 PTR. In the Profession Spells category. Added in World of Warcraft: Shadowlands. Always up to date with the latest patch (9.2.5).
thesimscatalog.com/sims4/category/clothing/page/25,The Sims 4 Clothing - FREE Downloads. Discover and download the best clothing items for FREE at The Sim Catalog!
vipvideo.juicemobi.com/video/1049,"JuiceMobi. Watch kids like Nursery rhymes, kids songs videos, all in one! Learning and playing H5 games!"
woojr.com/monster-mirror-drawing-worksheets/monstery-symmetry-1,Printable Monster Drawing Page for Kids . Woo! Jr. Kids Activities : Childrens Publishing. Printable Monster Drawing Page for Kids
bleedingcool.com/games/steelseries-unveils-new-mmo-moba-lightweight-gaming-mice,SteelSeries Unveils New MMOMOBA Lightweight Gaming Mice. SteelSeries has released a new line of gaming mice this week that are both multi-use and specifically designed for MMO and MOBA titles.
candycrushmom.com/level-2165,"Tips and Walkthrough: Candy Crush Level 2165. Candy crush level 2165 tips, strategy guide and a walkthrough video to complete this level easily."
ccm.net/gaming/games/3483-how-to-create-a-world-with-a-seed-in-minecraft,"Create a world with a seed in Minecraft. HOW TO CREATE A WORLD IN MINECRAFT In addition to the default Minecraft world, the video game allows you to generate other worlds where you can interact. To do this, you will need Minecraft seeds. Seeds are codes composed of numbers and letters that you must enter in order to generate new worlds with incredible landscapes and places."
esoui.com/downloads/download2577-onlycastcrystalfragmentsproc,"Only Cast Crystal Fragments Proc : Only Cast Crystal Fragments Proc Download : Elder Scrolls Online AddOns. The Elder Scrolls Online, AddOns and Mods Community."
fandomspot.com/sims4-clutter-cc-mods,"Best Sims 4 Clutter Mods & CC Packs: The Ultimate List - FandomSpot. For many players, controlling the day-to-day lives of Sims is their favorite part of the game. For others, its having absolute freedom to build the house of..."
funwithmama.com/letter-e-printable-pack,"Letter E Worksheets Activities - Fun with Mama. This free Letter E worksheets pack focuses on the letter e, letter e sounds and letter e words. It is another addition to our Free alphabet ABC Printable Packs. Each activity pack is filled with fun activities, worksheets, clip cards and"
game8.co/games/animal-crossing-new-horizons/archives/290264,List of Seasonal DIY Furniture & Item Recipes . ACNH - Animal Crossing: New Horizons (Switch).Game8. This page lists the Seasonal furniture and items you can get using the various seasonal Materials in Animal Crossing: New Horizons (ACNH). Read on to see the recipes and the required materials to craft the items of each seasonal series.
gamebanana.com/mods/364165,"Android 21: More reColors Dragon Ball FighterZ Mods. bae... A Dragon Ball FighterZ (DB:FZ) Mod in the Android 21 (Lab Coat) category, submitted by xxSJxx"
games.ca.zone.msn.com/en/outspell/default.htm,"MSN - Game Landing Page. Play the best free games, deluxe downloads, puzzle games, word and trivia games,multiplayer card and board games, action and arcade games, poker and casino games, pop culturegames and more. MSN Games has it all."
lexulous.com/v2/g/32594299,"Game #32594299 - Lexulous Word Game. A word game that is addictive & challenging! Play with friends, people across the world or in solo mode. App is available for all Apple and Android devices."
lexulous.com/v2/g/32750600,"Game #32750600 - Lexulous Word Game. A word game that is addictive & challenging! Play with friends, people across the world or in solo mode. App is available for all Apple and Android devices."
lexulous.com/v2/g/32850945,"Game #32850945 - Lexulous Word Game. A word game that is addictive & challenging! Play with friends, people across the world or in solo mode. App is available for all Apple and Android devices."
modland.net/beamng.drive-mods/cars/page/13,"BeamNG.drive Cars Mods - Page 13 - ModLand.net. The cars mods for BeamNG.drive game are very attractive and popular among players. There is wide variety of colors to choose from and cars of many different brands. They are good representative of Western European and Russian automotive industry, so every player can find something nice to drive according their personal taste. You can choose and download any car mode in short period of time and can quickly jump into the action. Great thing about car"
pcgamer.com/page/5,"PC Gamer - page 5. PC Gamer is your source for exclusive reviews, demos, updates and news on all your favorite PC gaming franchises."
retroheadz.com/retro-games/top-down-racing-driving-games/3,The Retro Top Down Racing & Isometric Driving Games to Play Today. Retroheadz takes a nostalgic look at the coolest top down racing games that are still great fun to play again today. Do you remember these?
segmentnext.com/marvel-vs-capcom-3-character-unlock-guide,Marvel vs Capcom 3 Character Unlock Guide - SegmentNext. Use this guide to help you unlock all the possible characters in Marvel vs Capcom 3 to see which one best suits your fighting style
slashfilm.com/715855/the-best-characters-in-spider-man-no-way-home-ranked,"The Best Characters In Spider-Man: No Way Home, Ranked. The guest appearances in Spider-Man: No Way Home are more than just fan service. Each character plays a crucial role. Heres how they rank."
smogon.com/forums/threads/doubles-ubers.3661142,"Metagame - Doubles Ubers . Smogon Forums. Welcome to Doubles Ubers, where beasts like Zacian-Crowned roam wild! Like all official Smogon tiers, Doubles Ubers is restricted to Pokemon that are..."
studystack.com/flashcard-2236375,"Free Biochemistry Flashcards about AP BIO Final. Study free Biochemistry flashcards about AP BIO Final created by studystacksat to improve your grades. Matching game, word search puzzle, and hangman also available."
studystack.com/wordscramble-893812,Spanish Word Scramble Game about Realidades 1 5AB. Word Scramble and other fun interactive activities to help learn information about modified list of 5AB vocabulary
vgchartz.com/game/226035/the-legend-of-zelda,"The Legend of Zelda for Series - Sales, Wiki, Release Dates, Review, Cheats, Walkthrough. VGChartz delivers comprehensive game chart coverage, including sales data, news, reviews, & game database for PS4, PS5, Xbox One, Series X, Nintendo Switch & PC"
videoquizstar.com/en/quiz/rae2f/answer/6lxw0,Wheel of Reward - Christmas Edition. Can you master the Wheel of Reward this Christmas?
wowhead.com/diablo-2/guides/act-4-walkthrough-quests,"Diablo II: Resurrected Patch 2.4 Act IV - Walkthrough - Guides - Wowhead. This guide will give you a full rundown of all of the quests and enemies you can expect to find in Act 4, including how to kill Diablo, the Act boss."
50gameslike.com/games-like/call-of-duty-wwii/switch,"50 Games Like Call of Duty: WWII for Nintendo Switch. 50 games like Call of Duty: WWII you can play right now, comparing over 60 000 video games across all platforms and updated daily."
codycrossanswers.com/codycross-inventions-group-49-puzzle-3-answers,CodyCross Inventions Group 49 Puzzle 3 Answers - CodyCross Answers All Levels. Please find below all the CodyCross Inventions Group 49 Puzzle 3 Answers. CodyCross is a brand new game developed by Fanatee. The idea behing this trivia app is very simple actually. You are given various crossword clues and you have to guess the correct answers. For each answer that you find you get bonus letters ...Continue reading CodyCross Inventions Group 49 Puzzle 3 Answers
dailyslotsrewards.com/double-down-casino-chips-250000-link4-15,"Double Down Casino Chips 250,000 Link4 - Daily Slot Rewards. doubledown Free Chips and Promo Codes"
eurogamer.net/cyberpunk-2077-patch-notes-update-1-5-9013,"Cyberpunk 2077 latest patch notes: Whats new in next gen update 1.5? . Eurogamer.net. Everything you need to know about the Cyberpunk 2077 next gen 1.5 update, including the complete 1.5 patch notes."
fanbyte.com/guides/pubg-mobile-ranked-squad-tiers,"How To Team Up With Friends in PUBG Mobile Ranked Mode. With unranked now splitting PUBG Mobile, heres what you need to know about squading up to climb the PUBG Mobile ranked ladder."
gamesradar.com/how-to-get-meltan-pokemon-go-lets-go,"Pokemon Go Meltan: How to catch the Hex Nut pocket monster . GamesRadar. Heres how to catch Meltan in Pokemon Go, and evolve it into Melmetal"
lexulous.com/v2/g/32729859,"Game #32729859 - Lexulous Word Game. A word game that is addictive & challenging! Play with friends, people across the world or in solo mode. App is available for all Apple and Android devices."
party-expert.com/collections/carnival,"Carnival Birthday Party Collection . Party Expert. Shop Carnival themed birthday party collection with tableware, decorations, balloons, party supplies and lots of fun party games for the whole family."
reviewgeek.com/98367/arcade1up-combined-ms-pac-man-and-galaga-for-its-latest-machine,"Arcade1Up Combined Ms. Pac-Man and Galaga for Its Latest Machine - Review Geek. Its time to travel back to the past with Arcade1Ups Class of 81 machine, a full-sized cabinet that lets you play Ms. Pac-Man, Galaga, and several other classics to your hearts content. Not only that, but the Class of 81 machine features original artwork, plus authentic controls and Wi-Fi support for online leaderboards."
thecactuschronicles.com/moon-knight-on-disney-plus-a-parents-guide,"Moon Knight on Disney Plus: A Parents Guide. With a TV-14 rating that includes language, violence and more, heres what parents need to know about Moon Knight on Disney Plus."
thegamersnet.worldmoneybusiness.com/shipbroman-foregone-review,Shipbroman Foregone PC review - The Gamers Net. Foregone review of the Twitch streamer shipbroman
thisonlineworld.com/app-flame-review,"App Flame Review - Is This Mobile Gaming App Legit & Worth It?. App Flame lets you earn rewards for playing new mobile games. But, is this app legit? Lets find out in our official review."
