url,contents
noobfeed.com/blogs/4832/10-games-worth-picking-at-the-playstation-spring-sale,10 Games Worth Picking at the PlayStation Spring Sale. 
pcgamer.com/call-of-duty-may-be-skipping-2023-but-warzone-2-will-fill-the-gap,"Call of Duty may be skipping 2023, but Warzone 2 will fill the gap . PC Gamer. For the first time since 2004, it looks like Call of Duty will go a year without a mainline game in the series in 2023. According to a report from Bloomberg, the Treyarch-developed Call of Duty game planned for 2023 will be delayed one year to 2024. The new Infinity Ward Modern Warfare sequel announced for this year is still on track, as are plans to release a sequel to the free-to-play Call of Duty: Warzone.Though it"
polygon.com/reviews/2020/6/5/21280820/command-and-conquer-remastered-review-pc-windows-ea,"Command and Conquer Remastered review: A classic gets the treatment it deserves - Polygon. Command and Conquer Remastered is a respectful yet unexpectedly playful second chance for two classic games, three expansions, and a whole bunch of bonus content, especially for the price."
qnnit.com/seed-of-the-dead-sweet-home-official-r18-patch,"Seed of the Dead Sweet Home Official R18 Patch. (UPDATED) April 2022 - Qnnit. Check out ! Seed of the Dead Sweet Home Official R18 Patch. Its one of the millions of unique, user-generated 3D experiences created on Qnnit."
rolimons.com/player/3464663962,"BorsNosyys . Profile . Rolimons. BorsNosyys is a player on Roblox. See their Value, RAP, Limiteds, Trade Ads and more at Rolimons!"
segmentnext.com/attack-on-titan-2-skills,Attack on Titan 2 Character Skills Guide - SegmentNext. Attack on Titan 2 Skills Guide to help you learn everything about all the available skills in the game. Skills in AOT2 have a variety of different uses.
spikeybits.com/2017/12/new-double-sided-game-mats-available-for-the-holidays.html,New Double-Sided Game Mats Available For the Holidays. Gamemat.EU has 4 brand new double-sided game mats that are available now. Lets take a look at these new battle mats that could be on your table!
tbc.wowhead.com/tempest-keep,Tempest Keep - Zone - TBC Classic. A contested raid. In the Zones category. Added in World of Warcraft: The Burning Crusade. Always up to date with the latest patch (2.5.4).
thefunkystitch.com/8-harry-potter-scarf-knitting-pattern,8 Harry Potter Scarf Knitting Pattern - The Funky Stitch. Get 8 Harry Potter scarf knitting patterns for free. Tons of photos and color options inside. Cute gift idea for a big Harry Potter fan.
arstechnica.com/gaming/2019/07/blizzards-starcraft-cartooned-makes-the-rts-classic-look-like-a-kids-tv-show,"Official StarCraft mod makes the game look like a Saturday morning cartoon . Ars Technica. Hands-on with 10 update for StarCraft Remastered: Its clean, cute, and hilarious."
comicbookroundup.com/comic-books/reviews/idw-publishing/the-kill-lock,"The Kill Lock Comic Series Reviews at ComicBookRoundUp.com. Compare critic reviews for The Kill Lock comics, published by IDW Publishing."
esoui.com/downloads/info3223-exoysrockgroover.html,"ExoYs Rockgroover : Raid Mods : Elder Scrolls Online AddOns. The Elder Scrolls Online, AddOns and Mods Community."
game-oldies.com/play-online/contra-nintendo-nes,Play Contra Nintendo NES online . Play retro games online at Game Oldies. Play Contra Nintendo NES game online for free in your browser. No download required.
game8.co/games/animal-crossing-new-horizons/archives/285884,"All Bug Prices and Who to Sell To . ACNH - Animal Crossing: New Horizons (Switch).Game8. This is a list of all bug prices in Animal Crossing: New Horizons, ordered from high to low. See who to sell to, find out how many bells each bug sells for at Nook&#39;s Cranny and earn the most money when catching bugs!"
game8.co/games/elden-ring/archives/370838,Best Ashes of War . Elden Ring.Game8. This guide will cover the best Ashes of War to pick up in Elden Ring and where to find them! Read on to learn the locations and characteristics of the best Ashes of War!
game8.co/games/genshin-impact/archives/376010,"The Floral Courtyard: Part 3 Guide . Genshin Impact.Game8. The Floral Courtyard: Part III is the third quest for The Floral Courtyard during Genshin Impact&#39;s Hues of the Violet Garden event. Check out how to arrange the Floral Courtyard with the hints, a full quest guide, the total rewards, and more!"
gamesradar.com/best-spiderman-games,"10 best Spider-Man games of all-time, ranked . GamesRadar. Peter Parkers best appearances in video games, from arcade classics to cinematic PS5 action"
imagineforest.com/blog/ghost-names,"500 Ghost Names: Good & Evil Ghosts . Imagine Forest. List of over 500 ghost names, from good ghosts to evil one. Super spooky ghost name generator including both female and male ghost names."
knowtechie.com/can-the-sony-playstation-4-play-dvds,"Can the Sony PlayStation 4 play DVDs?. The PlayStation 4 is obviously a great way to play some really awesome games, but can the console from Sony play DVDs?"
lexulous.com/v2/g/32930802,"Game #32930802 - Lexulous Word Game. A word game that is addictive & challenging! Play with friends, people across the world or in solo mode. App is available for all Apple and Android devices."
ptr.wowhead.com/news/new-campaign-skip-for-alts-in-patch-9-2-skip-zereth-mortis-and-pocopoc-325161,"New Campaign Skip For Alts in Patch 9.2 - Skip Zereth Mortis and Pocopoc Introduction - Wowhead News. Blizzard has added a new skip in Patch 9.2, Eternitys End! This skip allows you to skip the first 3 chapters of the 9.2 Campaign for alts, unlocking Zereth Mortis and the first Cypher of the First Ones system with the Pocopoc unit."
s1.game4y.com/games/challenge-jigsaw-456-ag,"456 Challenge Jigsaw. 456 Challenge Jigsaw is a kind of interesting puzzle game jigsaw, which is developed for the people who love the movie. 456 Challenge Jigsaw includes 12 images and several background images. Hope you can have fun in this game."
ultraboardgames.com/the-voting-game/game-rules.php,"How to play The Voting Game . Official Rules . UltraBoardGames. All information about boardgames. Reviews, tips, game rules, videos and links to the best board games, tabletop and card games."
uploadvr.com/best-music-rhythm-games-quest-2,Best Music & Rhythm Games On Quest 2: Beat Saber & More. Looking for a good VR rhythm or music game to play on Quest? Here are our best picks.
vg247.com/genshin-impact-sakura-bloom-location-farm-reset,"Genshin Impact Sakura bloom location: How to farm Sakura Bloom . VG247. If youre looking to level up Ayaka fast, youll need to find plenty of Sakura Bloom. Our Genshin Impact Sakura Bloom guide has them all."
video-facts.com/en/play/km8s6g/wrong-answer/7,Lucky Wheel: Halloween Edition. Can you correctly answer our questions based on our spooky Halloween clues? Find out now!
webkinznewz.ganzworld.com/announcements/look-for-the-floating-rainbow-frosting,Look for the Floating Rainbow Frosting! . WKN: Webkinz Newz. Between April 12 and 18 you can win a Rainbow Frosting every day when you see it floating around Webkinz Newz!
wowroms.com/es/roms/nintendo-gameboy-advance/download-super-mario-advance-4-super-mario-bros.-3-usa/14363.html,"Super Mario Advance 4 : Super Mario Bros. 3 USA-Nintendo Gameboy Advance (GBA) rom descargar . WoWroms.com . start download. Super Mario Advance 4 : Super Mario Bros. 3 USA rom para Nintendo Gameboy Advance (GBA) y Play Super Mario Advance 4 : Super Mario Bros. 3 USA en sus dispositivos Windows PC, Mac, iOS y Android! . start download"
y8.com/games/toby_s_adventures,"Tobys Adventures Game - Play online at Y8.com. Tobys Adventures is an HTML5 game for PC, tablet and mobile devices. Collect all the food and reach the door to finish the level. Break bricks, avoid obstacles and enemies on your way. Its ads free and always will be."
achievemorethanaverage.com/starry-for-cash-app-review,Starry For Cash App Review: Legit Or Just Another Fake? - Achieve More Than Average. Is this game another fake or can you make more money then you have ever dreamt of? Read this Starry For Cash app review to find out.
ccm.net/download/download-25449-bubble-shooter-game-for-android,"Download the latest version of Bubble Shooter Game for Android free in English on CCM - CCM. Bubble shooter game download - Legendary Bubble Shooter game is now available for Android devices! The idea of this puzzle game is simple: you just have to match 3 colors and clear levels. Aim and shoot to drop and burst all the bubbles. It is a free to play relaxing game,..."
classic.wowhead.com/skill=554/undead-horsemanship,Undead Horsemanship - Skill - Classic World of Warcraft. A skill in the Secondary Skills category. Always up to date with the latest patch (1.14.3).
codycrossanswers.net/sign-design-used-to-identify-products-companies,"Sign design used to identify products companies - CodyCross Answers Cheats and Solutions. Find out Sign design used to identify products companies Answers. CodyCross is a famous newly released game which is developed by Fanatee. It has many crosswords divided into different worlds and groups. Each world has more than 20 groups with 5 puzzles each. Some of the worlds are: Planet Earth, Under The Sea, Inventions, Seasons, ...Continue reading Sign design used to identify products companies"
fanbyte.com/reviews/blocky-dungeon-lets-you-build-a-dungeon-crawler-out-of-tetris-blocks,"Blocky Dungeon Lets You Build a Dungeon Crawler Out of Tetris Blocks. Blocky Dungeon is a good Tetris game wrapped in an even better dungeon crawler. Put it all together, and you get a very chill time!"
gamebanana.com/sprays/78274,"NSFW Zelda by Darkprincess04 Team Fortress 2 Sprays. A Team Fortress 2 (TF2) Spray in the Animated category, submitted by CampoConstantine"
itstillworks.com/12543278/how-to-reset-skill-points-in-diablo-2,How to Reset Skill Points in Diablo 2 . It Still Works. 
iwin.com/publisher/awem-games,Awem Games - Download and Play for Free at iWin.com. All games published by Awem Games
lexulous.com/v2/g/33030936,"Game #33030936 - Lexulous Word Game. A word game that is addictive & challenging! Play with friends, people across the world or in solo mode. App is available for all Apple and Android devices."
mariowiki.com/donkey_kong_country,"Donkey Kong Country - Super Mario Wiki, the Mario encyclopedia. Donkey Kong Country is a side-scrolling platform game for the Super Nintendo Entertainment System released in November 1994. It was developed by Rareware and published by Nintendo. The game stars Donkey Kong and his sidekick Diddy Kong, as the two travel across Donkey Kong Island to recover their banana..."
mobafire.com/league-of-legends/ability/watch-out-eep-968,"Watch Out! Eep! :: Lillia Ability :: League of Legends. Lillia ability in LoL, Watch Out! Eep!, at MOBAFire - premiere League of Legends strategy build guides and tools."
neowin.net/news/no-man039s-sky-outlaws-has-space-piracy-solar-starships-squadrons-and-more,"No Mans Sky Outlaws has space piracy, solar starships, squadrons, and more - Neowin. Hello Games latest free update to No Mans Sky delivers players a space pirating experience, a completely overhauled space combat structure, a new ship type, sidekick squadrons for support, and more."
ordinaryreviews.com/games-like-neopets,Top Games like Neopets: Seven Alternatives To Play Today. Users will enjoy the various customization tools that can be used to design stuff. Here are some interesting games like Neopets you can play today.
powerpyx.com/kena-bridge-of-spirits-collectibles-guide,"Kena Bridge of Spirits Collectibles Guide. Guide for All Collectible Locations in Kena Bridge of Spirits (Rots, Hats, Flower Shrines, Spirit Mail, Cursed Chests, Meditation Spots)."
ptr.wowhead.com/quest=63977/insider-trading,"Insider Trading - Quest - 9.2.5 PTR. Speak with various broker cartels around Oribos. A level 60 Tazavesh, the Veiled Market Quest. Rewards . Added in World of Warcraft: Shadowlands."
raiseyourskillz.com/how-to-play-competitive-pubg-beginners-guide,How to Play Competitive PUBG (Beginners Guide) - Raise Your Skillz. 
relyonhorror.com/latest-news/free-alice-the-madness-returns-app,Free Alice: The Madness Returns App - Rely on Horror. Down the rabbit hole on your mobile device.
slashgear.com/791637/things-you-never-knew-your-ps5-could-do,"Things You Never Knew Your PS5 Could Do. The PlayStation 5 is definitely a step up from the PS4. But aside from the obvious, there are some lesser-known PlayStation 5 features you might not know about."
svg.com/166340/greedfall-how-to-upgrade-your-weapons-and-armor,"Greedfall: How To Upgrade Your Weapons And Armor. The weapons and armor upgrade system acts as one of many ways you can customize your playstyle in Greedfall. The best items to use often differ from situation to situation, adding some extra depth, variety, and fun to an all too often monotonous gameplay mechanic."
t3.com/news/5-hidden-whatsapp-features-you-need-to-try,5 hidden WhatsApp features you need to try . T3. WhatsApps secret features to make your life easier
aetherhub.com/metagame/historic-bo1/deck/mono-blue-701506,Historic Metagame Mono Blue. Historic meta game list Mono Blue. Magic the Gathering and MTG Arena deck lists
apocanow.com/cheats/multi/19134/mafia-ii-definitive-edition,Mafia II: Definitive Edition Cheats Apocanow.com. Discover cheats and cheat codes for Mafia II: Definitive Edition (PC PS4 XBOX ONE): Endless Health and Invincible.
cinemablend.com/movies/transformers-rise-of-the-beasts-release-date-cast-and-other-quick-things-we-know,"Transformers: Rise Of The Beasts: Release Date, Cast And Other Quick Things We Know . Cinemablend. Here are some things we know about Transformers: Rise of the Beasts."
codycrossanswers.net/cool-fashionable-type-of-food-answers,Cool fashionable type of food Answers - CodyCross Answers Cheats and Solutions. Since you came to our website you are searching for Cool fashionable type of food Answers. This crossword clue belongs to CodyCross Medieval Times Group 238 Puzzle 5 Pack. We have shared all the answers for this amazing game created by Fanatee. If something is wrong with Cool fashionable type of food Answers please send ...Continue reading Cool fashionable type of food Answers
codycrossanswers.net/small-silver-coin-largely-used-in-ancient-rome,"Small silver coin largely used in Ancient Rome - CodyCross Answers Cheats and Solutions. Find out Small silver coin largely used in Ancient Rome Answers. CodyCross is a famous newly released game which is developed by Fanatee. It has many crosswords divided into different worlds and groups. Each world has more than 20 groups with 5 puzzles each. Some of the worlds are: Planet Earth, Under The Sea, Inventions, ...Continue reading Small silver coin largely used in Ancient Rome"
eventhubs.com/tiers/mk11/character/raiden,Raidens tier match-ups in Mortal Kombat 11 Ultimate. 
fanbyte.com/news/dragon-age-inquisition-romance-dorian-pavus,"Dragon Age: Inquisitions Best Romance Was its Least Popular. According to David Gaider, Dorian Pavus romance was the least popular among Dragon Age: Inquisitions players."
game8.co/games/pokemon-sword-shield/archives/275603,"Galarian Moltres- Evolutions, Location, and Learnset . Pokemon Sword and Shield.Game8. This is a page on Galarian Moltres, including its learnable moves and where it can be found in Pokemon Sword and Shield. Read on for information on its evolutions, abilities, type advantages, and location."
game8.co/games/yu-gi-oh-master-duel/archives/366641,"PSY-Framegear Gamma Effect, Rarity, and Related Packs . Yu-Gi-Oh! Master Duel.Game8. PSY-Framegear Gamma is a Effect card in Yu-Gi-Oh Master Duel! Read on to see the card effect of PSY-Framegear Gamma, its rarity, and all the packs used to unlock PSY-Framegear Gamma!"
gameanswers.net/en/words-of-wonders/obersee/level-635,"(WOW) Words Of Wonders Obersee Level 635 answers . All levels. Find out all the popular Words Of Wonders Answers, Cheats & Solutions for iPhone, iPad & Android. Simple search!"
gamesnostalgia.com/game/champions_,The Boss (Commodore 64) Game Download. The Boss - Get it on GamesNostalgia - The Boss (called Champions! initially) is a soccer management sim created by Peaksoft in 1984 for the Commodore 64.
gamesradar.com/au/best-video-game-movies,"The 10 best video game movies of all time . GamesRadar. The best video game movies of all time, from Silent Hill, to Resident Evil, and 2020s Sonic the Hedgehog"
hardcoregamer.com/features/yakuza-6-hostess-guide-hikaru/296572,Yakuza 6 Hostess Guide: Hikaru - Hardcore Gamer. Return to the Main Hostess Hub
ign.com/wikis/carrion/walkthrough,"Walkthrough - Carrion Wiki Guide - IGN. IGN&apos;s Carrion complete strategy guide and walkthrough will lead you through every step of Carrion from the title screen to the final credits, including"
mobafire.com/league-of-legends/build/12-6-quick-sion-top-guide-575621/discussion,Sion Build Guide : 12.6 Quick Sion Top Guide :: League of Legends Strategy Builds. 12.6 Quick Sion Top Guide. Sion build guides on MOBAFire. League of Legends Premiere Sion Strategy Builds and Tools.
mtggoldfish.com/archetype/commander-lynde-cheerful-tormentor,"Lynde, Cheerful Tormentor Deck for Magic: the Gathering. Lynde, Cheerful Tormentor deck list with prices for Magic: the Gathering (MTG)."
nevermanagealone.com/fantasy-player-picks,Fantasy Player Picks - Never Manage Alone. A section containing columns dedicated specifically to helping fantasy managers pick players for the upcoming match week.
nickfinder.com/ff,"FF - Names and nicknames for FF. Nicknames, cool fonts, symbols and tags for FF - sHRK BADBOYtsu, ?nickname, ?NYiNIA, auLLDonauLL, RAg, BM kIng. Create good names for games, profiles, brands or social networks. Submit your funny nicknames and cool gamertags and copy the best from the list."
pcgamer.com/new-world-legendary-weapon-quests,New World legendary weapon quest guide . PC Gamer. Heres how to unlock Madakis Stratagem and get started on the legendary weapon quest in Aeternum.
turtlediary.com/game/multiplication-house-painter.html,Multiplication House Painter Game . Turtle Diary. Play Turtle Diarys Multiplication House Painter game. It is just one of many exciting and interactive math games on Turtle Diary
zigiz.com/card-games/play-free/sunsetsolitaire2,"Play Sunset Solitaire 2 game at Zigiz - Unlimited fun!. Play games on Zigiz. Cardgames, solitaire, dice games, Zigiz is the worlds favourite game corner! Play and win!"
brickseek.com/deal/halo-5-guardians-standard-edition/618780,Halo 5: Guardians Standard Edition - Xbox One - Deal - BrickSeek. BrickSeek features the newest and hottest deals on products across all categories. Click here to claim this deal and many others.
deckshop.pro/deck/detail/855,"Hog eDragon . Best Clash Royale decks, guides, tutorials, tips. Clash Royale deck information for ladder and tournaments. Counters, synergies, spell damages. Everything you need to know about your deck!"
download-free-games.com/pc/mystery-case-files-crossfade-collectors-edition.htm,Mystery Case Files: Crossfade Collectors Edition Game - Download and Play Free Version!. The biggest hurdle that Master Detective must fight is time itself! In MCF - Crossfade CE
earlym.org/manga/990k-ex-life-hunter/chapter-60,"990k Ex-Life Hunter Chapter 60 English. EarlyManga releases the chapters earlier than other manga sites, you could read the chapters up to 2 days earlier!"
eso-hub.com/en/buffs-debuffs/major-force,Major Force - ESO Hub - Elder Scrolls Online. Major Force is a buff and increases your critical damage. Major Force can be found in things like...
game8.co/games/shin-megami-tensei-iii-nocturne/archives/333300,"Amala Temple Walkthrough, Boss Battles, and Item Locations . Shin Megami Tensei 3: Nocturne (SMT Nocturne).Game8. This is a story walkthrough for Amala Temple in Shin Megami Tensei III HD Remaster (SMT Nocturne) for the Nintendo Switch, PS4, and Steam. Here you&#39;ll find a guide on how to complete this area, story section, boss strategies, general tips, and a list of items that can be found."
gamesradar.com/spider-man-no-way-home-digital-secret-bonus,Spider-Man: No Way Home digital release includes a secret bonus featurette - if you know where to look . GamesRadar. Heres how to access your hidden bonus featurette from the Spider-Man: No Way Home digital release
lexulous.com/v2/g/32726784,"Game #32726784 - Lexulous Word Game. A word game that is addictive & challenging! Play with friends, people across the world or in solo mode. App is available for all Apple and Android devices."
pcgamer.com/cd-projekt-says-new-unreal-engine-5-witcher-game-wont-be-exclusive-to-one-storefront,"CD Projekt says new Unreal Engine 5 Witcher game wont be exclusive to one storefront . PC Gamer. The biggest surprise of today&apos;s Witcher 4 announcement (that&apos;s just what we&apos;re calling it until it has a title) is not that it&apos;s happening&#x2014;of course it&apos;s happening&#x2014;but that CD Projekt is switching from its in-house developed REDengine to Unreal Engine 5. REDengine, in various iterations, was used in The Witcher 2, The Witcher 3, and Cyberpunk 2077, but its time "
sporcle.com/games/mitchellgoosen/marvel-comics-100-tiny-x-men,Marvel Comics: 100 Tiny X-Men Quiz. Can you name all 100 of the tiny X-Men characters?
ultraboardgames.com/ticket-to-ride/expansions.php,"Ticket to Ride Expansions . UltraBoardGames. All information about boardgames. Reviews, tips, game rules, videos and links to the best board games, tabletop and card games."
zimbio.com/pop+quiz+guess+the+bands+from+the+picture+puzzles/articles/fctmidtfzdi/deadmau5,Deadmau5 - Pop Quiz: Guess the Bands From the Picture Puzzles - Zimbio. Deadmau5 -
beebom.com/games-like-mortal-kombat,"15 Amazing Games like Mortal Kombat You Can Play . Beebom. Looking for fighting games similar to Mortal Kombat for PS4, Xbox One or PC? Here are 15 great games like Mortal Kombat you can play in 2017."
bosslevelgamer.com/warhammer-3-factions-ranked-from-worst-to-best-9543,"Warhammer 3 Factions Ranked From Worst to Best. All Total War: Warhammer 3 factions are good in their own right, but some are definitely stronger and more fun to play than others."
br.op.gg/spectate/list/pro-gamer,"List of Professional Gamers - League of Legends. Real-time LoL Stats! Check your Summoner, Live Spectate and using powerful global League of Legends Statistics!"
broadsheet.com.au/adelaide/entertainment/article/adelaides-own-grand-theft-auto,"Adelaides Own ""Grand Theft Auto"". An upcoming videogame lets you race through the streets of Adelaide in a Metro Bus."
eurogamer.net/articles/elden-ring-godfrey-the-first-elden-lord-tips-strategy-8042,"Elden Ring Godfrey the First Elden Lord tips and strategy . Eurogamer.net. How to beat Godfrey the First Elden Lord in Elden Ring, with Godfrey the First Elden Lord and strategies."
eurogamer.net/assassins-creed-odyssey-has-a-wonderful-new-coda,Assassins Creed Odyssey has a wonderful new coda . Eurogamer.net. This weeks arrival of the fantastic - and completely free - Assassins Creed Stories crossover was much heralded for b...
feartheboot.com/ftb,"Fear the Boot, RPG Podcast. A podcast and blog offering an irreverent look at tabletop roleplaying games and a little bit more."
futhead.com/packs/open/generations,"Generations Pack - FIFA 22 Pack Simulator - Futhead. Open a virtual FIFA 22 pack, the Generations Pack!"
gamebanana.com/sounds/60167,"Terry Voice Mod The King of Fighters XV Sound Mods. A The King of Fighters XV (KOFXV) Sound Mod in the OtherMisc category, submitted by qtt"
gamesradar.com/call-of-duty-4-modern-warfare-review,"Call of Duty 4: Modern Warfare review . GamesRadar. Editors Note, Nov 9, 2007:&nbsp;Weve changed this games&nbsp;score from the original 9 up to a 10. The reason is simple: the more we&nbsp;play the"
gamesradar.com/tiny-tinas-wonderlands-modders-have-added-a-loot-tier-that-doesnt-properly-exist-in-the-game-yet,Tiny Tinas Wonderlands modders have added a loot tier that doesnt properly exist in the game yet . GamesRadar. Ascended gear is raising some eyebrows
lexulous.com/v2/g/32824132,"Game #32824132 - Lexulous Word Game. A word game that is addictive & challenging! Play with friends, people across the world or in solo mode. App is available for all Apple and Android devices."
match3games.com/zuma+games,"Zuma and Marble Popper Games - Match3Games.com. Play the best free Zuma and Marble Popper games online for desktop, tablet and phone. In Zuma games you shoot balls into chains of different colors and you need to connect at least 3 of the same colored balls."
nihrida.com/best-phones/for-call-of-duty-mobile,"5 Best Gaming Phones for Call of Duty: Mobile - All you need to know. In this article, we look at the best gaming phones for Call of Duty: Mobile, a free-to-play shooter game for Android and iOS."
ourpastimes.com/play-rummy-cube-7697040.html,"How to Play Rummy Cube . Our Pastimes. Rummikub, also known as Rummy Cube or Tile Rummy, is a tile-based game for two to four players. The 106 tiles are divided into sets numbered 1 through 13, with two sets in each of four different colors, plus two joker tiles that serve as wild cards. Rummikub is similar to card-based rummy games, in which players try ..."
svg.com/590187/what-fans-think-mccrees-new-name-will-be,"What Fans Think McCrees New Name Will Be. While the developer hasnt made its plans known for McCree, some gamers have a guess as to what the new handle for the western-themed ""Overwatch"" hero might be"
venturebeat.com/2019/07/18/nolan-bushnell-reveals-alexa-powered-murder-mystery-board-game-st-noire,"Nolan Bushnell reveals Alexa-powered murder mystery board game St. Noire . VentureBeat. Atari cofounder Nolan Bushnell and Hollywood creative director Zai Ortiz have created St. Noire, an Alexa-powered murder mystery board game."
